body,sentiment_label,sentiment_score,sarcasm_label,sarcasm_score,classification
Lol he was a starter for most of the year,4 stars,0.42729535698890686,sarcasm_less,0.9954407215118408,neutral
it's all parta the job,5 stars,0.3462859094142914,sarcasm_less,0.9960721731185913,neutral
# LMAO butker,3 stars,0.2367178201675415,sarcasm_less,0.9976847171783447,neutral
#LMAO 2nd string kicker?,1 stars,0.3456161618232727,sarcasm_less,0.9988532066345215,neutral
what are the comparable teams in terms of those whose windows collapsed so completely like the bengals?,2 stars,0.37930241227149963,sarcasm_less,0.9999306201934814,neutral
All the other Bengals playoff eras?,3 stars,0.2583467662334442,sarcasm_less,0.999919056892395,neutral
"I think it was forward, but it's cool nevertheless",4 stars,0.45086827874183655,sarcasm_less,0.999727189540863,neutral
"It could've been forward, but the angles they showed aren't definitive.",3 stars,0.5987873077392578,sarcasm_less,0.99998939037323,neutral
"Is this stands, who gets what in terms of rushing credit?",1 stars,0.39173752069473267,sarcasm_less,0.9998376369476318,neutral
I think they both do,3 stars,0.39419883489608765,sarcasm_less,0.9892183542251587,neutral
Exactly what I was wondering. Haha. Maybe Nix up until the lateral then Javonte gets the rest? I guess we'll see,4 stars,0.3735712468624115,sarcasm_less,0.9999736547470093,neutral
chiefs looking like my ex girlfriend that cheated on me with 3 dudes,1 stars,0.3020527958869934,sarcasm_less,0.9977990984916687,neutral
New York going to white knight the Chiefs backups here?,1 stars,0.33134371042251587,sarcasm_less,0.9870332479476929,neutral
RULE OF COOL!!!,5 stars,0.7487304210662842,sarcasm_less,0.9983658194541931,neutral
"""And I'll fuckin do it again""",5 stars,0.35227128863334656,sarcasm_less,0.9976516366004944,neutral
Ball don't lie Bo is my GOAT,1 stars,0.5513113141059875,sarcasm_less,0.997465968132019,neutral
"broncos, if you're gonna win, make it big please",5 stars,0.32970619201660156,sarcasm_less,0.8555488586425781,neutral
# jets recover a fumble,1 stars,0.5946435928344727,sarcasm_less,0.9977453351020813,neutral
refs forgot that the ball doesn't lie,1 stars,0.31858035922050476,sarcasm_less,0.9979156851768494,neutral
"Obligatory ""HAHA CHIEFS ARE FRAUDS"" if only this was the week 10 game",1 stars,0.5717282295227051,sarcasm_more,0.9973957538604736,sarcastic
Broncos gonna sit starters soon?,3 stars,0.29357174038887024,sarcasm_less,0.9996349811553955,neutral
Not with the way we've been playing in the second half this year,2 stars,0.4665142893791199,sarcasm_less,0.9992444515228271,neutral
They gotta pull them now man,1 stars,0.261011004447937,sarcasm_less,0.990728497505188,neutral
I'm going to just come out and say it. Wentz is bootycheeks.,1 stars,0.4962020814418793,sarcasm_less,0.9996662139892578,neutral
It's also the best defense in the league and he's playing with backups.,5 stars,0.7647392153739929,sarcasm_less,0.9999905824661255,neutral
"Not just backups, literal practice squad players are playing this game and other backups are playing out of position to fill spots. This was always going to be an absolute blowout.",1 stars,0.6796694397926331,sarcasm_more,0.9970394968986511,sarcastic
"Didn't know the backups had a stop in 'em, hell yeah",1 stars,0.3792654871940613,sarcasm_more,0.9928170442581177,sarcastic
This game is so boring I turned it off so I can get a head start on my paperwork next week,1 stars,0.7078981399536133,sarcasm_less,0.9998201727867126,neutral
tony romo sounds so sad bro ðŸ˜­ðŸ˜­,1 stars,0.48172080516815186,sarcasm_less,0.9974445104598999,neutral
This is so fucking embarrasing lmao,1 stars,0.8500789403915405,sarcasm_more,0.96507728099823,sarcastic
So they're just running up the score at the risk of their starters or what?,3 stars,0.44989341497421265,sarcasm_less,0.9932408332824707,neutral
Hahahahahahahaha have you seen the Broncos with a lead since the 2016 season?,1 stars,0.3395092785358429,sarcasm_less,0.9998005032539368,neutral
If you can't trust a 38-0 lead idk why you watch the sport man gotta relax a little lol,4 stars,0.24914661049842834,sarcasm_less,0.9669040441513062,neutral
This is going to be the funniest comeback ever,5 stars,0.7965313792228699,sarcasm_more,0.8409947156906128,neutral
Led by a 3rd stringer out of SDSU? I would just die.,1 stars,0.435306191444397,sarcasm_less,0.9999769926071167,neutral
Pretty sure 35 is largest ever margin of victory for Denver in this matchup,4 stars,0.28550174832344055,sarcasm_less,0.9994580149650574,neutral
"Man, bengals fans aren't beating the allegations... That they're a bunch of whiny bitches.",1 stars,0.532153308391571,sarcasm_more,0.9251790642738342,sarcastic
Congrats on the win today :),5 stars,0.41133353114128113,sarcasm_less,0.9992019534111023,neutral
Why didn't Mahomes come in for 1 snap to keep his consecutive start streak going?,1 stars,0.36762532591819763,sarcasm_less,0.9998575448989868,neutral
He has to protect his house from burglars.,4 stars,0.4684860408306122,sarcasm_less,0.9999881982803345,neutral
He doesn't strike me as the type of dude who gives a shit about stuff like that,2 stars,0.3786553144454956,sarcasm_less,0.9957975149154663,neutral
What's his streak? I think the bills only did it because Josh's streak is like 120 games or something,3 stars,0.2952618896961212,sarcasm_less,0.9999246597290039,neutral
He's in KC. His wife is having a baby any day now.,4 stars,0.3482723534107208,sarcasm_less,0.9999904632568359,neutral
I thought Mahomes was staying in KC in case Brittany gies into labor.,3 stars,0.33265650272369385,sarcasm_less,0.9999889135360718,neutral
I think she is due in the next week or two.,3 stars,0.38345393538475037,sarcasm_less,0.9999881982803345,neutral
Chiefs look like they're actively throwing this game,5 stars,0.384304940700531,sarcasm_less,0.8746035099029541,neutral
Playing 15 backups wasn't obvious?,3 stars,0.261494904756546,sarcasm_less,0.9999349117279053,neutral
Backups showing why they're backups.,4 stars,0.4118628203868866,sarcasm_less,0.9999891519546509,neutral
What sitting 40% of your starters does to a team,5 stars,0.4596851170063019,sarcasm_less,0.9975091218948364,neutral
How's that not a first,1 stars,0.30251726508140564,sarcasm_less,0.7455223202705383,neutral
It's where the ball is when he steps out. The ball was behind marker.,1 stars,0.3486926555633545,sarcasm_less,0.9999895095825195,neutral
Romo can't keep Mahomes out of his mouth ðŸ’€,1 stars,0.3363367021083832,sarcasm_less,0.999157190322876,neutral
Are you really surprised that Mahomes is being talked about in a fucking CHIEFS game?,1 stars,0.34831705689430237,sarcasm_less,0.989250898361206,neutral
Why so mad ðŸ’€ðŸ’€ðŸ’€ðŸ’€ðŸ’€ðŸ’€ðŸ’€,1 stars,0.5959715843200684,sarcasm_less,0.9984620809555054,neutral
Sort of a curse for Nix to get false confidence against backups the week before playoffs,1 stars,0.6085702180862427,sarcasm_less,0.9955711960792542,neutral
I mean you gotta win this game to get in the playoffs. Better ball out,5 stars,0.28644123673439026,sarcasm_less,0.9997591376304626,neutral
"Good thing he only has to duel a random bum like Josh Allen in the playoffs, I'm sure it'll go great",4 stars,0.6424615383148193,sarcasm_more,0.9997722506523132,humorous
Momentum is a powerful thing,5 stars,0.6337725520133972,sarcasm_less,0.9979129433631897,neutral
I know commentators love glazing mahomes but this is ridiculous,1 stars,0.6409082412719727,sarcasm_less,0.9999159574508667,neutral
What is Patrick crying about??,1 stars,0.36667534708976746,sarcasm_less,0.9997146725654602,neutral
Refs don't have to pay attention to him today,3 stars,0.2758759558200836,sarcasm_less,0.9997833371162415,neutral
Hopefully thats a sign of things to come in the next few weeks for KC.,3 stars,0.4551926553249359,sarcasm_less,0.9999895095825195,neutral
Never like to see Butker miss.,2 stars,0.39765432476997375,sarcasm_less,0.9999889135360718,neutral
I LOVE it,5 stars,0.8333382606506348,sarcasm_less,0.9916930794715881,positive
We fucking suck without any of our good players damn,1 stars,0.8144824504852295,sarcasm_more,0.5337526798248291,neutral
"This just in, team sucks without star players. More at 9!",1 stars,0.7784768342971802,sarcasm_less,0.9999741315841675,neutral
Nix being fucked,1 stars,0.7396574020385742,sarcasm_less,0.9968727231025696,neutral
Another weak one lol,1 stars,0.5219653844833374,sarcasm_less,0.9917578101158142,neutral
It would be awesome if KC played some random qb who balled put instead of Wentz.,3 stars,0.34193605184555054,sarcasm_less,0.9999477863311768,neutral
QB3 will likely make a 2nd half appearance. The main problem is 2nd string OL and the limiter on the defense.,2 stars,0.43862974643707275,sarcasm_less,0.9999841451644897,neutral
"We call that ""pulling a Drew Lock"" around here",3 stars,0.20854870975017548,sarcasm_less,0.9965144991874695,neutral
I think Oludoken is active (I know I spelled that wrong),3 stars,0.27591222524642944,sarcasm_less,0.9999212026596069,neutral
What's Henne up to?,5 stars,0.26575860381126404,sarcasm_less,0.99935382604599,neutral
Nobody wants to see the Steelers in the playoffs I'll tell you that!,1 stars,0.3148861229419708,sarcasm_less,0.9999164342880249,neutral
From a neutral fan's perspective you're absolutely right. Would be a horrible 3 hours of bad football.,1 stars,0.3932371139526367,sarcasm_less,0.9999549388885498,neutral
Defense paired with the ground and pound while playing for field position wins championships!,5 stars,0.6961334347724915,sarcasm_less,0.9998518228530884,neutral
Least of all the Steelers!,1 stars,0.5655240416526794,sarcasm_less,0.9987651109695435,neutral
As in the game will be so boring I won't want to watch it?,2 stars,0.4948132634162903,sarcasm_less,0.9999411106109619,neutral
Brother defense and field position is how football was meant to be played,5 stars,0.4356136620044708,sarcasm_less,0.99983811378479,neutral
"Nah, we gotta have the Pennsylvania Bowl happen",3 stars,0.3461712598800659,sarcasm_more,0.9596171975135803,sarcastic
The Ravens do and are quite ready to clap them hard,4 stars,0.5112527012825012,sarcasm_less,0.9998847246170044,neutral
But brother the Steelers and ravens know each other well ðŸ˜‚,4 stars,0.4472953677177429,sarcasm_less,0.7757171988487244,neutral
Fair point. Divisional games can go either way,4 stars,0.5346144437789917,sarcasm_less,0.9999902248382568,neutral
I was kidding. Our offense sucks even though I think we fair a bit better than the chargers would have,2 stars,0.3920522928237915,sarcasm_less,0.999984860420227,neutral
Sad how little effort the Chiefs are putting in.,2 stars,0.3486775755882263,sarcasm_less,0.9999895095825195,neutral
I can't wait to hear Colin cowherd completely glaze bo nix after this game on Monday.,1 stars,0.721574604511261,sarcasm_less,0.9903685450553894,neutral
I understand the rules. But it feels against the spirit of football to call that a TD,3 stars,0.41297027468681335,sarcasm_less,0.9999910593032837,neutral
"Like, the ball crossed by dimples. It's a TD, it's always been a TD, but idk it just feels wrong",2 stars,0.4382956922054291,sarcasm_less,0.8994540572166443,neutral
You think the Chiefs didnt try so Denver cant watch game film to counter in playoffs?,1 stars,0.3180488049983978,sarcasm_less,0.9999185800552368,neutral
They have plenty of film from the first matchup,4 stars,0.3266295790672302,sarcasm_less,0.9977920055389404,neutral
"I don't think they ""didn't try"", but They were always going to go extremely vanilla so no one had any more film than they needed to.",3 stars,0.39478176832199097,sarcasm_less,0.9999903440475464,neutral
Don't think KC is particularly concerned about seeing the Broncos in the post season,3 stars,0.4007910192012787,sarcasm_less,0.9983698725700378,neutral
"People claiming Mahomes was calling for a flag, he was saying ""throw it away!"" Good lord you are deranged",1 stars,0.8133900761604309,sarcasm_more,0.817739725112915,neutral
""" if those kids can read they'd be very upset""",2 stars,0.33046388626098633,sarcasm_less,0.9999126195907593,neutral
"He's not even playing, why are they still glazing so hard",1 stars,0.6261439323425293,sarcasm_less,0.9996727705001831,neutral
Denver is the last chance for Chiefs haters (aka everybody) to finally rejoice,5 stars,0.3301885426044464,sarcasm_more,0.9861150979995728,humorous
I really don't think us losing today will hit the way chiefs haters want. Especially since many of them need us to win.,5 stars,0.34321123361587524,sarcasm_less,0.9999904632568359,neutral
Whatever I just make comments to make comments tbh,5 stars,0.28033965826034546,sarcasm_less,0.9585403203964233,neutral
"It shouldnt, you guys are sitting everyone. Anyone with a brain knows this isn't the true Chiefs team.",1 stars,0.42416298389434814,sarcasm_less,0.9991629123687744,neutral
Should've had this locked up already but couldn't kick a FG earlier this year against them.,2 stars,0.38011643290519714,sarcasm_less,0.9999886751174927,neutral
"I'm torn, of course I want DEN to lose and yet...",1 stars,0.45541146397590637,sarcasm_less,0.9998773336410522,neutral
KC tanking to play Denver,5 stars,0.47623029351234436,sarcasm_less,0.9931164979934692,neutral
We'd have to beat the Bills so I sincerely doubt that would work out anyways,3 stars,0.3880922496318817,sarcasm_less,0.9962356686592102,neutral
Meh forget the Bills McDermott is there he will do something stupid and lose,2 stars,0.5300168395042419,sarcasm_more,0.9566525816917419,sarcastic
"Kinda funny to see nix take one look downfield and just go ""fuck this"" and run it for like 2 yards",3 stars,0.5024192333221436,sarcasm_more,0.9824491739273071,sarcastic
All I'm saying is Brady never sat out any games,1 stars,0.4203970730304718,sarcasm_less,0.9993860721588135,neutral
It's nice sitting back without a care in the world and watching other fanbases over analyze the Chiefs performance today lol,4 stars,0.4860823452472687,sarcasm_less,0.9956965446472168,neutral
"Absolute garbage rule. I guess the ruling was correct, but that's an absolutely awful rule.",1 stars,0.9676841497421265,sarcasm_more,0.7807661294937134,neutral
No forward passes over the line of scrimmage?,1 stars,0.3787590265274048,sarcasm_less,0.9995623230934143,neutral
"A forward pass should be contingent on whether or not the ball left the passers hand on a forward trajectory, not where it was caught. The runners forward momentum is always going to result in this penalty in this kind of situation. The ball itself never traveled forward.",1 stars,0.40428537130355835,sarcasm_less,0.9999910593032837,neutral
It's forward or It's not. That's the rule. Can you imagine adding any subjectivity to that? People would go nuts when if a ruling goes against their team.,2 stars,0.35390716791152954,sarcasm_less,0.999982476234436,neutral
"Sure, we should just let people throw the ball forward past the line of scrimmage. That won't lead to any problems at all...",3 stars,0.37938812375068665,sarcasm_less,0.9999021291732788,neutral
"He did not throw the ball forward. He released it backwards. His forward momentum along with the runner running faster than the ball, causes it to be caught at an advanced position. This isn't difficult physics.",1 stars,0.5073084235191345,sarcasm_less,0.9999881982803345,neutral
"Literally against the rules. If the ball is caught past where the ball is released, it is a forward lateral and should not be allowed. This plays out all the time on screen passes.",1 stars,0.7551105618476868,sarcasm_less,0.9999452829360962,neutral
I agree. It is against the rules. I don't dispute that.,3 stars,0.4246658384799957,sarcasm_less,0.9999895095825195,neutral
chiefs charity event!,5 stars,0.6220375299453735,sarcasm_less,0.99951171875,neutral
How is KC gonna win the SB if they get ahut out vs teams like the broncos?,1 stars,0.3160949945449829,sarcasm_less,0.9994781613349915,neutral
"pull your starters broncos, no balls",5 stars,0.33899903297424316,sarcasm_less,0.9998925924301147,neutral
MVP JOE BURROW,5 stars,0.4970245957374573,sarcasm_less,0.9983969330787659,neutral
They deserved the last spot over the Broncos. Who will 1000% be knocked out in a not very exciting first playoff game. Waste of a last spot.,1 stars,0.43556690216064453,sarcasm_less,0.653652548789978,neutral
If they deserved it they should have won more games. This isn't college.,2 stars,0.36224332451820374,sarcasm_less,0.9999898672103882,neutral
How many Superbowls have the Chargers won?,1 stars,0.3523693084716797,sarcasm_less,0.9998841285705566,neutral
Downvoted yet incredibly accurate. Reddit babies at their finest,5 stars,0.8268244862556458,sarcasm_less,0.9998156428337097,positive
Chiefs suck. This team ain't 3peating,1 stars,0.6962406039237976,sarcasm_less,0.9998518228530884,neutral
This is literally a different team than you'll be seeing in the playoffs,1 stars,0.33784353733062744,sarcasm_less,0.9398620128631592,neutral
saving this in case Chiefs beat Ravens,5 stars,0.5797080993652344,sarcasm_less,0.9968066215515137,neutral
"Calling it now, Chargers win @Kansas City in 2 weeks",5 stars,0.31014150381088257,sarcasm_less,0.9999333620071411,neutral
Put money on it. Please,1 stars,0.4024801254272461,sarcasm_less,0.9999852180480957,neutral
Oh I so hope so,5 stars,0.3385070264339447,sarcasm_more,0.7430238127708435,neutral
Broncos should have beat these guys first time they played. Beat them last year.Broncos do not fear the Chiefs.,1 stars,0.4586491286754608,sarcasm_less,0.9999908208847046,neutral
Alex fucking Forsyth man....,1 stars,0.580036997795105,sarcasm_less,0.8500095009803772,neutral
"Should've, could've and didn't.",2 stars,0.44228553771972656,sarcasm_less,0.9999884366989136,neutral
ok but why didnt they call that PI against the chargers no i didnt forget,3 stars,0.5326211452484131,sarcasm_less,0.9963766932487488,neutral
Of course Mahomes is bitching about that hit. That was clean Kermit,2 stars,0.34024810791015625,sarcasm_more,0.9876355528831482,sarcastic
"KC better be careful, the stink of this game could follow them into the playoffs",2 stars,0.38230085372924805,sarcasm_less,0.9757871627807617,neutral
Last game last season was a 13-12 win over the Chargers playing Easton Stick where Blaine Gabbert was 15/30 and threw a pick. We'll be fine lol.,4 stars,0.24953657388687134,sarcasm_less,0.9999912977218628,neutral
That's not at all the same as being blown out 38-0 by the Broncos,3 stars,0.4061327278614044,sarcasm_less,0.9907230734825134,neutral
"If you think this game was in any way representative of the state of the team, coaching or game plan, I've got a bridge to sell you. If you think any coach of a playoff team is going to look at this game and study the film, idk what to tell you.",1 stars,0.5345830321311951,sarcasm_less,0.9999880790710449,neutral
A lot of effort to be eliminated by the Bills.,4 stars,0.3533121347427368,sarcasm_less,0.9999889135360718,neutral
"Oh yea likely we get demolished. But hey, thanks for gift wrapping us our first playoff game in about a decade :) very thoughtful of you all!",5 stars,0.5557822585105896,sarcasm_more,0.999985933303833,humorous
It's funny you think we give a shit. We haven't been to the post season in forever. We have a rookie QB and we are in cap hell. We could get blown out 38-0 and I think we'd be fucking happy. This season was a tremendous success by all accounts. Sit down goober.,5 stars,0.6445919275283813,sarcasm_more,0.6872099041938782,neutral
Broncos made the rest of us very happy today,5 stars,0.6330156922340393,sarcasm_less,0.9996669292449951,neutral
You must be one of those only been a chiefs fan for 5 years guys.,5 stars,0.6161686778068542,sarcasm_less,0.9999879598617554,neutral
"Pretty indifferent who made it through between Bengals, Dolphins, and Broncos, but in a 17 game season it's kind of bullshit that a team can get a free win in the last week because a different team played well.",3 stars,0.49994415044784546,sarcasm_less,0.9938934445381165,neutral
"This stuff happened in 16 game seasons too, lil bro",5 stars,0.5622587203979492,sarcasm_less,0.9707822203636169,neutral
"I meant a short season relative to other major sports, not relative to the 16 game game season.",2 stars,0.4074787199497223,sarcasm_less,0.9999884366989136,neutral
No such thing as a free win . Obviously the Chiefs players wanted to win....Cry more.,1 stars,0.44306594133377075,sarcasm_less,0.9912904500961304,neutral
You can't honestly be that delusional to think the chiefs tried to beat you right?,1 stars,0.5007398128509521,sarcasm_more,0.9202021360397339,sarcastic
"Yeah and I'm sure Denver will want to win next week, still a free win for the Bills",4 stars,0.4242570102214813,sarcasm_less,0.9966281056404114,neutral
While I've had the Bills as my AFC superbowl team all year....lets remember that we did beat them last time we played.,4 stars,0.269890159368515,sarcasm_less,0.9999895095825195,neutral
Come on man I'm a broncos fan and the chiefs let them in like the little brother who is really trying hard lol.,5 stars,0.4366114139556885,sarcasm_less,0.9999804496765137,neutral
We did our best Carson Wentz is just that bad lol,1 stars,0.30908843874931335,sarcasm_less,0.990620493888855,neutral
Nephews exposing themselves.,5 stars,0.40510210394859314,sarcasm_less,0.9999899864196777,neutral
Chiefs definitely afraid of Cincy lmao,1 stars,0.35243967175483704,sarcasm_less,0.9883885979652405,neutral
"Say what you will about this being 2nd string, but they should at least have put up a field goal by now. Remember these guys are supposed to fill in when starters get hurt, so they shouldn't be that much of a step down.",3 stars,0.3597618043422699,sarcasm_less,0.9998393058776855,neutral
Little different when it's one or two players not an entire 11 lol,3 stars,0.49368414282798767,sarcasm_less,0.9996976852416992,neutral
1 or 2 backups stepping in is a lot different than 10+ though,3 stars,0.4446365237236023,sarcasm_less,0.9972813129425049,neutral
"And they do a pretty good job, one at a time. Not so much 11 at a time, lol.",4 stars,0.5217719674110413,sarcasm_less,0.9999767541885376,neutral
lol no We aren't putting shit on film for this game. Not even a blitz.,1 stars,0.49286630749702454,sarcasm_less,0.7223944067955017,neutral
Yeah they're supposed to fill in here and there not have every single one of them out there at once,1 stars,0.3599601089954376,sarcasm_less,0.5342270135879517,neutral
There is no team in the league playing 17-18 backups that wouldn't struggle.,3 stars,0.29001814126968384,sarcasm_less,0.9999909400939941,neutral
Why are we even in here KC & Denver fans? Bengals sub has the Sunday afternoon thread in hopes the Broncos/Dolphins lost. I say we go in there and give them hell!!! Spam the comments and we come back right back here! On we go!,1 stars,0.7953523993492126,sarcasm_less,0.9956998825073242,neutral
"Yeah, champ! Let them know you beat a rested Chiefs. Spill that salt.",5 stars,0.7514405846595764,sarcasm_more,0.9972758889198303,humorous
Not even that lmao. They're talking shit about both teams.,1 stars,0.5204392671585083,sarcasm_less,0.9999594688415527,neutral
"Wait, are we praising Nix for good performances vs the Bengals D and the Chiefs 3rd stringers?",1 stars,0.43289870023727417,sarcasm_less,0.9999179840087891,neutral
"Right? Like you choose who you play against and shouldn't be judged by the lineup you're given, it's crazy! /S",1 stars,0.27002212405204773,sarcasm_less,0.9998596906661987,neutral
We're talking about setting records here. You really think there's no point in the last 10 years a QB has gotten to face two bad defenses in a row? Or backups?,1 stars,0.33663731813430786,sarcasm_less,0.9900972843170166,neutral
"So Chiefs you remember when we beat the Patriots for you in the last week for the 1 seed, so yeah I think you can return the favor now. ðŸ™‚",1 stars,0.5129106640815735,sarcasm_less,0.9999581575393677,neutral
Let's go Chos!,5 stars,0.4139949679374695,sarcasm_less,0.9996892213821411,neutral
Broncos need to go back to these throwbacks full time. Why did they ever move away from them? So fresh and clean.,5 stars,0.6903557777404785,sarcasm_less,0.9999502897262573,neutral
"Broncos picked the wrong uniforms, no one will believe it's modern Broncos, and not something from the dark times. ðŸ˜‚",1 stars,0.397149920463562,sarcasm_less,0.9999843835830688,neutral
ya that weird period were we went to 5 superbowls. So dark.,1 stars,0.38401365280151367,sarcasm_less,0.9999498128890991,neutral
Mims has been fantastic the last few weeks,5 stars,0.6512773036956787,sarcasm_less,0.9988675117492676,neutral
That was very beautiful,5 stars,0.3030012547969818,sarcasm_less,0.9921157956123352,neutral
Ok that's it. Staters in.,3 stars,0.7365632653236389,sarcasm_less,0.9898057579994202,neutral
There are no commentators? Or is there an issue,1 stars,0.3664916753768921,sarcasm_less,0.9984847903251648,neutral
And no sound on ads?,1 stars,0.492672860622406,sarcasm_less,0.9999175071716309,neutral
I've got Romo's goofy ass coming through loud and clear,5 stars,0.43752315640449524,sarcasm_less,0.8413023352622986,neutral
Nice start to the game!,4 stars,0.47322511672973633,sarcasm_less,0.9993748068809509,neutral
Here we go,5 stars,0.4955168664455414,sarcasm_less,0.9721121788024902,neutral
"Who do Chiefs fans hate more, Broncos or Raiders?",1 stars,0.3691890835762024,sarcasm_less,0.9999393224716187,neutral
Every AFC West team hates the Raiders the most,1 stars,0.45048320293426514,sarcasm_less,0.995897650718689,neutral
"Broncos for me. It used to be the Raiders, but now I just pity them.",3 stars,0.28387635946273804,sarcasm_less,0.9999886751174927,neutral
"And a roll on the first snap, lol. We're so fucked this game.",1 stars,0.6499101519584656,sarcasm_less,0.9136985540390015,neutral
Is there a horse at the broncos game? I keep hearing horse neighing.,2 stars,0.2875765562057495,sarcasm_less,0.9999891519546509,neutral
