body,sentiment_label,sentiment_score,sarcasm_label,sarcasm_score,classification
I like how CBS's graphics team showed Lake Tahoe for a Denver game,4 stars,0.5331776142120361,sarcasm_less,0.9985887408256531,neutral
Looking like we'll have two 15-2 teams as the one seeds this year,4 stars,0.31499236822128296,sarcasm_less,0.9970691800117493,neutral
C'mon Wentz. Throw it into the ground.,1 stars,0.38233381509780884,sarcasm_less,0.9983181953430176,neutral
Hendershot is a pretty good named receiver for Wentz to throw to.,4 stars,0.47151979804039,sarcasm_less,0.9999903440475464,neutral
"Thus could be any score, chiefs just want this game over with",1 stars,0.5123704671859741,sarcasm_less,0.9776495099067688,neutral
The ref just called false start on our CB Joshua Williams lol They even put his name on the graphic,1 stars,0.5832186937332153,sarcasm_less,0.9638451933860779,neutral
Matthew McConaughey looks like he needs to lay off the coke for a few weeks.,3 stars,0.4150574803352356,sarcasm_less,0.99998939037323,neutral
It's been a long time Crash,1 stars,0.4719296991825104,sarcasm_less,0.9903830885887146,neutral
Matthew McConaughey acting like a weird conspiracy theorist just seems like Matthew McConaughey being himself.,3 stars,0.33442482352256775,sarcasm_less,0.9999758005142212,neutral
I love how he's embraced a public persona that's just based on him being weird as shit.,5 stars,0.5320225954055786,sarcasm_less,0.9999077320098877,neutral
"Shoot, in a not very talented WR room, losing a blocking WR like him with our run game is RIP",2 stars,0.4870198369026184,sarcasm_more,0.9939893484115601,sarcastic
I love Bo Nix so much man,5 stars,0.7735878825187683,sarcasm_less,0.9978596568107605,neutral
24 scrambles for 1st downs is freaking impressive.,5 stars,0.5934200882911682,sarcasm_less,0.8736628293991089,neutral
I think Romo and Nance are about to cum...,3 stars,0.4506765604019165,sarcasm_less,0.9999396800994873,neutral
A spooky ghost is going to visit that booth.,4 stars,0.333687424659729,sarcasm_less,0.9999896287918091,neutral
Fucking Chiefs ruin everything. Bengals are cooked bros,1 stars,0.917269229888916,sarcasm_more,0.83124840259552,neutral
The announcers in the Titans and Texans game were having a lot more fun and were much more entertaining than Nantz and Romo while also commentating a bad game. Maybe Nantz and Romo need to be reevaluated as the CBS commentating A-team.,3 stars,0.42205023765563965,sarcasm_less,0.99998939037323,neutral
"I mean this game is kind of bad too. The Chiefs clearly don't give a fuck (understandable, but still)",2 stars,0.4828528165817261,sarcasm_less,0.9112253189086914,neutral
I think the ice storm knocked out my feed to the game. Probably a blessing really lol,2 stars,0.36367735266685486,sarcasm_less,0.9999852180480957,neutral
Theres an imaginary line in the state of Kansas that splits the state into Broncos fans,4 stars,0.31393861770629883,sarcasm_less,0.9996017813682556,neutral
We don't talk about western Kansas. 'Tis a dark and depressing place.,2 stars,0.4126541316509247,sarcasm_less,0.9999876022338867,neutral
Lols theres nothing between Lawrence and Colorado,1 stars,0.4098863899707794,sarcasm_less,0.792446494102478,neutral
Why does Nate think we care about the Miami game? Literally makes no difference to us.,1 stars,0.44496938586235046,sarcasm_less,0.9606708884239197,neutral
Ball don't lie,1 stars,0.6735342741012573,sarcasm_less,0.9955220222473145,neutral
Anybody got the latest on the dolphins game!? I have to know,1 stars,0.3187698721885681,sarcasm_less,0.9995682835578918,neutral
they are up 6-0,1 stars,0.3273352384567261,sarcasm_less,0.9923068881034851,neutral
Tua quit on his team. They're up 6-0 because Aaron Rodgers is a top 29 qb.,1 stars,0.4237731099128723,sarcasm_less,0.9999898672103882,neutral
"The pocket Bo Nix has all game is insane, lol. We're not gonna get a single pressure on him",1 stars,0.805915355682373,sarcasm_less,0.8298758268356323,neutral
I can't tell if the team legitimately looks good or if this is just beating up on non-starters.,3 stars,0.350952684879303,sarcasm_less,0.9999637603759766,neutral
Why not both?,1 stars,0.40531811118125916,sarcasm_less,0.9956969022750854,neutral
We are starting people that were signed 3 days ago,1 stars,0.32285305857658386,sarcasm_less,0.9978216886520386,neutral
Well I'll give Payton some credit. He's not coaching like he's playing against backups and third stringers,3 stars,0.47786250710487366,sarcasm_less,0.9994786381721497,neutral
They gotta earn that playoff spot ðŸ¤“,5 stars,0.442732572555542,sarcasm_less,0.9992530941963196,neutral
Well folks I am cooked Gonna eat some chicken nuggets and pray the Bengals remember the season starts in September next year ðŸ«¡,5 stars,0.3691593110561371,sarcasm_more,0.9915106892585754,humorous
Nix calling for the snap like it's 1987.,1 stars,0.27916884422302246,sarcasm_less,0.9999673366546631,neutral
"Well, have you seen today's uniforms?",5 stars,0.26566383242607117,sarcasm_less,0.9999396800994873,neutral
Holy shit was that Mike McGlinchey? Dude gave me PTSD as a Niner,1 stars,0.8169811964035034,sarcasm_more,0.9966872334480286,sarcastic
Why the TOs?,1 stars,0.4001384377479553,sarcasm_less,0.997328519821167,neutral
This is going to be our worst performance in Denver since 2012,1 stars,0.7904126048088074,sarcasm_less,0.9992495179176331,neutral
We were pretty bad in Denver last year (Mahomes flu),2 stars,0.3896411955356598,sarcasm_less,0.9998118281364441,neutral
That was only 15 points. This game will be worse,1 stars,0.4410548806190491,sarcasm_less,0.9999901056289673,neutral
"Fuck, I missed a quarter coz the Korean Airport got so many fucking escalators and I don't understand shit - finally got to the lounge and now I'm watching the game",1 stars,0.5673027038574219,sarcasm_more,0.9995396137237549,sarcastic
"I'd take the escalators over this one, tbh.",2 stars,0.3473735451698303,sarcasm_less,0.9999210834503174,neutral
[This is the ride!](,5 stars,0.572074830532074,sarcasm_less,0.9999066591262817,neutral
Did I miss something this week? Why isn't Mahomes playing? Are they just trying to keep him healthy and just lose this game since they are #1?,1 stars,0.5510534048080444,sarcasm_less,0.9999380111694336,neutral
Yes. Everyone important is resting,5 stars,0.4448340833187103,sarcasm_less,0.9999890327453613,neutral
I'm actually kinda shocked how bad our running D is without Chris Jones and Turk Wharton,3 stars,0.40885505080223083,sarcasm_less,0.9876583218574524,neutral
Jones deserves all the money lol,5 stars,0.5365126132965088,sarcasm_less,0.9970244765281677,neutral
The sneaks are sneaking fr,2 stars,0.3586318790912628,sarcasm_less,0.9703247547149658,neutral
"As good as the early games were today, these late games suuuuuuuck. I really hope tonight's game makes up for it.",5 stars,0.4933947026729584,sarcasm_less,0.9999850988388062,neutral
"Hey chiefs - ""hut 1, hut 2, hut 3"" means Bo will going slightly to the right behind the right guard",3 stars,0.3411638140678406,sarcasm_less,0.9998587369918823,neutral
Bro not cool. Don't just give it away,2 stars,0.43710413575172424,sarcasm_less,0.999941349029541,neutral
"Jesus Christ, Romo! Even when Mahomes is on the sideline, Romo's still riding lol",5 stars,0.33710557222366333,sarcasm_more,0.9657760262489319,humorous
Taking the whole thing too,5 stars,0.5018070936203003,sarcasm_less,0.7843210697174072,neutral
Wonder if the Broncos rest their starters if they score here and we get a back up game. Lol,3 stars,0.2526392638683319,sarcasm_less,0.9999878406524658,neutral
LMFAO WHAT WAS THAT,5 stars,0.24118928611278534,sarcasm_more,0.5916708111763,neutral
Just like they drew it up.,5 stars,0.4915652275085449,sarcasm_less,0.9999874830245972,neutral
Lmfao what a catch,5 stars,0.4846467971801758,sarcasm_more,0.9604852199554443,humorous
"these backups finding new ways to be trash, amazing",5 stars,0.7385590076446533,sarcasm_more,0.9307031631469727,humorous
lol what even was that,1 stars,0.35588377714157104,sarcasm_less,0.765171229839325,neutral
That was madness,1 stars,0.477403849363327,sarcasm_less,0.99605393409729,neutral
Just like they drew it up,5 stars,0.4719955027103424,sarcasm_less,0.9985383749008179,neutral
LET IT STAND ANYWAY,5 stars,0.25096410512924194,sarcasm_less,0.9966320395469666,neutral
What a catch!,5 stars,0.7338427901268005,sarcasm_less,0.9998292922973633,neutral
My god the chiefs back ups suck,1 stars,0.5630856156349182,sarcasm_more,0.7151665687561035,neutral
WHAT THE FUCK LMAO OH MY GOD,1 stars,0.6665478348731995,sarcasm_less,0.7037268280982971,neutral
That was awesome!,5 stars,0.7039897441864014,sarcasm_less,0.9998276233673096,neutral
"Welp, sorry Bengal bros",1 stars,0.4134763777256012,sarcasm_more,0.998488187789917,sarcastic
Holy shit lol,5 stars,0.4506860673427582,sarcasm_less,0.9318636059761047,neutral
somehow a fitting end to the bengals season,4 stars,0.41418635845184326,sarcasm_less,0.6874589920043945,neutral
That was fucking cool,3 stars,0.31119072437286377,sarcasm_more,0.5499769449234009,neutral
Joseph will be wishing diarrhea to all of the starters at half time.,3 stars,0.23694927990436554,sarcasm_less,0.9999895095825195,neutral
Professional team murders puppies.. crowd goes wild?,1 stars,0.4119998514652252,sarcasm_less,0.9997692704200745,neutral
I was told Carson Wentz was good before this game started,1 stars,0.29869160056114197,sarcasm_less,0.9987940788269043,neutral
"Overall, he was probably better before this game started.",3 stars,0.6738564968109131,sarcasm_less,0.9999895095825195,neutral
To be fair he's working with our backup OL,3 stars,0.3679511845111847,sarcasm_less,0.9973026514053345,neutral
Dang that's one of the craziest touchdowns ever. Kind of like the Prayer at Jordan share for Auburn.,5 stars,0.5645973086357117,sarcasm_less,0.9277395606040955,neutral
Sorry - Prayer was even crazier by x1000,1 stars,0.5757110118865967,sarcasm_less,0.8313269019126892,neutral
RIP bungles and doophies,1 stars,0.5321156978607178,sarcasm_less,0.8685204982757568,neutral
Gotta love the effort.,5 stars,0.6082536578178406,sarcasm_less,0.9991720914840698,neutral
[Live look at the Bengals fanbase](,5 stars,0.3475515842437744,sarcasm_less,0.9972133040428162,neutral
"I get that there's no Texans gear in sight for the Diggs/Dominos commercial, but it still hurts.",3 stars,0.5535486936569214,sarcasm_less,0.9999897480010986,neutral
"This offense with Nix at QB and the group of Sutton, Mims, and Vele are gonna some problems in the playoffs",2 stars,0.2770928144454956,sarcasm_less,0.9999496936798096,neutral
I can't imagine we'll beat Buffalo but it does make me happy for the future if we can get one more WR.,4 stars,0.4815494120121002,sarcasm_less,0.9999899864196777,neutral
They go to Buffalo first stop so I don't think so.,3 stars,0.4053085148334503,sarcasm_less,0.9999892711639404,neutral
They don't have consistent enough run game to cause any problems.,3 stars,0.4008890688419342,sarcasm_less,0.9999890327453613,neutral
Are Cincinnati fans who happen to be lawyers drawing up a civil suit against the Chiefs for tanking this? Or have I just binged too much Suits recently?,1 stars,0.3951208293437958,sarcasm_more,0.995969295501709,sarcastic
Will the chiefs get a first down this game?,1 stars,0.27267274260520935,sarcasm_less,0.9996943473815918,neutral
Kc just gonna run the ball all game to get it over with faster I respect it.,5 stars,0.5752967000007629,sarcasm_less,0.999984860420227,neutral
That was a nice fucking throw edit: NEVERMIND THAT WAS A NICE FUCKING CATCH,1 stars,0.3182707130908966,sarcasm_more,0.9785087704658508,sarcastic
We got a first down :D,3 stars,0.2674400210380554,sarcasm_less,0.9999109506607056,neutral
Indeed. Fuck KU. EMAW ;),1 stars,0.3454039394855499,sarcasm_less,0.9999719858169556,neutral
ok this is weird...,3 stars,0.6789955496788025,sarcasm_less,0.9980712532997131,neutral
He's a KU fan. And I'm a Kstate fan. Not that surprising,3 stars,0.6057487726211548,sarcasm_less,0.9999845027923584,neutral
Typical sheep humper saying Fuck KU in games where they aren't even playing. Stay weird EMAW dude..,1 stars,0.5027661323547363,sarcasm_less,0.7989424467086792,neutral
One it was a joke and two we interact fairly often,3 stars,0.3233933746814728,sarcasm_less,0.9999507665634155,neutral
Bears pre season games be like,5 stars,0.2951743006706238,sarcasm_less,0.996488094329834,neutral
The chiefs need to just throw bombs down the field at this point...,1 stars,0.32220932841300964,sarcasm_less,0.9982372522354126,neutral
Please do. Surtain could use some stats.,3 stars,0.5094268321990967,sarcasm_less,0.9999873638153076,neutral
I would be super hype about the Chiefs getting blown out if: - A: they weren't 15-1 with the 1 seed - B: Broncos winning kills off every other game that isn't MIN/DET,1 stars,0.3305072486400604,sarcasm_less,0.9493040442466736,neutral
Every other game = Dolphins/Jets so 1 game.,1 stars,0.5395374894142151,sarcasm_less,0.9999868869781494,neutral
Cincy was geared up to do some damage in the playoffs. Unfortunate for them for sure.,3 stars,0.5704397559165955,sarcasm_less,0.9999886751174927,neutral
It might be that winning games in the NFL is important or something like that.,3 stars,0.4622188210487366,sarcasm_less,0.9999850988388062,neutral
"Yeah, never a good strategy needing help in other games to make it.",2 stars,0.4417727589607239,sarcasm_less,0.9999803304672241,neutral
"Yeah, I think every other afc playoff team is cheering for us. No one wants the Bengals heat right now. After an eight year playoff drought...I don't give a shit! We, hopefully, are goi g to the playoffs!!!!!",1 stars,0.43485167622566223,sarcasm_more,0.9930322170257568,sarcastic
What damage? 2-7 against playoff teams is why this team is out of the playoffs.,1 stars,0.6142512559890747,sarcasm_less,0.9999902248382568,neutral
"Part of me wants to watch football, part of me is more interested in my CFB25 Road to Glory. My junior QB started life at Mizzou, broke a couple records, threw three picks in the Natty as a Sophomore as we got blown out by Oregon and then transferred to Clemson because Dabo needed a Klubnik successor and 93 OVR was it (presumably fat stacks of NIL were involved but the game hasn't caught up in this regard). Currently in the Heisman and Natty hunt.",3 stars,0.3344574272632599,sarcasm_less,0.8643157482147217,neutral
Stopped watching and now watching the Cardinals CB and 49ers' Jennings fight between every play,1 stars,0.4680425226688385,sarcasm_less,0.9999048709869385,neutral
"Jennings kicked out the game, 25 yards short of 1000. Dumbass.",1 stars,0.8237161040306091,sarcasm_less,0.9998856782913208,neutral
Ok then we don't need your updates about that game,3 stars,0.6148061156272888,sarcasm_less,0.9943515062332153,neutral
Jennings ejected. Oh sorry,1 stars,0.6711328029632568,sarcasm_less,0.971203625202179,neutral
God Andy Reid runs a tight ship. Even these backups don't commit penalty's what a team.,5 stars,0.3346768319606781,sarcasm_more,0.9921236634254456,humorous
Lmao classic Carson Wentz hero ball,5 stars,0.5699543356895447,sarcasm_more,0.9964816570281982,humorous
"I'm a very casual NFL watcher, mainly watch college. Is KC resting starters for this game?",3 stars,0.3620925843715668,sarcasm_less,0.9999916553497314,neutral
"""THROW IT AWAY [you dipshit]""",1 stars,0.6022061109542847,sarcasm_less,0.9998356103897095,neutral
Zach Allen got snubbed too. Hope he gets All-Pro,3 stars,0.2574692368507385,sarcasm_less,0.9999825954437256,neutral
The fuck is going on here,1 stars,0.47536465525627136,sarcasm_less,0.9260676503181458,neutral
Carson Wentz is no Chad Henne,1 stars,0.38729777932167053,sarcasm_less,0.9982660412788391,neutral
Such a troll job by the chiefs,5 stars,0.6191880106925964,sarcasm_more,0.7910845279693604,neutral
Wanya Morris legacy drive,5 stars,0.2743082046508789,sarcasm_less,0.9974164962768555,neutral
Whole lot of work for -2 yards,5 stars,0.45486295223236084,sarcasm_less,0.819770336151123,neutral
"With that run of 15 yards, Carson gains -2 yards.",2 stars,0.24727503955364227,sarcasm_less,0.99998939037323,neutral
"Even when they're just killing time or filling dead air, I'll never understand sportscasters wasting breath pointing out that a player sitting out the game or resting on the sidelines is cheering for their own team. Like fucking duh? What other possibilities are you even imagining there? That they're gonna be like, ""Nah fuck all of them, if I'm not playing I hope they all die out there""?",1 stars,0.6822681427001953,sarcasm_more,0.9999409914016724,sarcastic
"*what is this, a center for ants?*",5 stars,0.2865428626537323,sarcasm_less,0.9999488592147827,neutral
Even butker is tanking,5 stars,0.24326832592487335,sarcasm_less,0.9876649975776672,neutral
"""There are multiple reads?"" -Carson Wentz",2 stars,0.29060667753219604,sarcasm_less,0.9999275207519531,neutral
Chiefs are not trying to beat the allegations lol,1 stars,0.3734772801399231,sarcasm_less,0.999797523021698,neutral
Didn't know the chiefs sent the backup kicker too,1 stars,0.2926245927810669,sarcasm_less,0.9855794906616211,neutral
Are the Chiefs resting their starting kicker?,3 stars,0.31191161274909973,sarcasm_less,0.9996980428695679,neutral
Receiving an ass kicking is the most relaxed I've been watching KC all year.,5 stars,0.7259409427642822,sarcasm_less,0.9999901056289673,neutral
Bo Nix. That is all,1 stars,0.4894852340221405,sarcasm_less,0.9999669790267944,neutral
Lmao love it,5 stars,0.7154784798622131,sarcasm_less,0.9960296154022217,neutral
"lol, what an unnecessary lateral",1 stars,0.4494457244873047,sarcasm_more,0.999794065952301,sarcastic
You know what hell yeah go get in form for buffalo guys,1 stars,0.34364497661590576,sarcasm_more,0.9983034133911133,sarcastic
lol. I'm loving this,5 stars,0.668170154094696,sarcasm_less,0.9999700784683228,neutral
Nix is in his bag right now,1 stars,0.5326184034347534,sarcasm_less,0.9980844259262085,neutral
I don't even know what to do with my hands,2 stars,0.31395789980888367,sarcasm_less,0.9943293929100037,neutral
this rookie class is everything,5 stars,0.8242058157920837,sarcasm_less,0.9902573823928833,positive
That was fun,3 stars,0.441851407289505,sarcasm_less,0.9954362511634827,neutral
OH MY FUCKING GOD LMAO THIS IS AMAZING,5 stars,0.8740542531013489,sarcasm_more,0.9701378345489502,humorous
Bo Knows ... where all his guys are at all times,3 stars,0.28223884105682373,sarcasm_less,0.9976708292961121,neutral
An object in motion stays in motion. Beastly run though,1 stars,0.44686147570610046,sarcasm_less,0.9999895095825195,neutral
"Bo ""Hot Potato"" Nix",2 stars,0.41326120495796204,sarcasm_less,0.9998176693916321,neutral
If we're going to put this little effort into the game why even risk the second stringers? Send in the third stringers. This is straight up bad television.,1 stars,0.6008682250976562,sarcasm_more,0.9998329877853394,sarcastic
Theres not enough roster spots for third stringers,2 stars,0.34572312235832214,sarcasm_less,0.9989976286888123,neutral
"At least Brandon Perna is probably happy, I guess",3 stars,0.4629156291484833,sarcasm_less,0.9979971051216125,neutral
"The idea was there, they just rushed it",1 stars,0.4158494472503662,sarcasm_less,0.999581515789032,neutral
Looked good to me.,4 stars,0.4811692237854004,sarcasm_less,0.9999881982803345,neutral
"Just like re-marrying from my first wife to my second wife, that was a lateral move",5 stars,0.3923106789588928,sarcasm_less,0.9999393224716187,neutral
cool play rules should be in effect idc what the letter of the law actually is,4 stars,0.37681734561920166,sarcasm_less,0.9979395270347595,neutral
That's what chiefs fans were saying when Toney was offsides lol I'll pass,1 stars,0.4022201895713806,sarcasm_less,0.996343195438385,neutral
Didn't account for the forward momentum of ball. Should took more physics classes in his 17 years of college.,2 stars,0.546112596988678,sarcasm_less,0.9999903440475464,neutral
penalty - no fun allowed :(,1 stars,0.762445330619812,sarcasm_less,0.9997616410255432,neutral
"I've never thought of that being a forward pass. I get it, but he was clearly passing to a player behind him. I feel like logic should take over on that play.",3 stars,0.39650022983551025,sarcasm_less,0.9999899864196777,neutral
What a explanation lmao,4 stars,0.2348921149969101,sarcasm_more,0.6655011773109436,neutral
"Oh, Horse MANURE!!!!",1 stars,0.3992306888103485,sarcasm_more,0.999083399772644,sarcastic
That's a dumb ass rule I didn't know that was it,1 stars,0.5598099827766418,sarcasm_less,0.9453504681587219,neutral
you didn't know it was illegal to throw the ball forward when you're twenty yards downfield?,1 stars,0.4376499354839325,sarcasm_less,0.9999074935913086,neutral
Not that a line is drawn where you threw it he was clearly behind him the entire time,1 stars,0.44767019152641296,sarcasm_less,0.9983155727386475,neutral
I can see from this GDT that the KC psy ops campaign is in effect,4 stars,0.3763631582260132,sarcasm_less,0.9982972741127014,neutral
Good fucking lord,5 stars,0.6293221116065979,sarcasm_less,0.7890563011169434,neutral
The Pro Bowl this year is pretty entertaining.,4 stars,0.571811318397522,sarcasm_less,0.9999889135360718,neutral
OH COME ON LET US HAVE SOME GODDAMN FUN,5 stars,0.46094468235969543,sarcasm_more,0.9992570281028748,humorous
Lol I thought Nix was about to do it again.,2 stars,0.3523499667644501,sarcasm_less,0.9999871253967285,neutral
I would have loved it if he faked a pitch,3 stars,0.29014596343040466,sarcasm_less,0.9997604489326477,neutral
Boo these Refs are no fun,1 stars,0.6980308294296265,sarcasm_less,0.6513833403587341,neutral
Fkn do it again,5 stars,0.4828060269355774,sarcasm_less,0.9969731569290161,neutral
Ball don't lie fuckers,1 stars,0.752173662185669,sarcasm_less,0.7758197784423828,neutral
bo nix is inevitable,2 stars,0.36017560958862305,sarcasm_less,0.9986373782157898,neutral
"Denver STILL not calling timeout, this is so fucking stupid.",1 stars,0.9225143790245056,sarcasm_less,0.6838669776916504,neutral
just venmo'd sean hochuli $50,1 stars,0.3699236214160919,sarcasm_less,0.9978852868080139,neutral
KC is playing like they're on all-madden difficulty against a cheating CPU,1 stars,0.22910988330841064,sarcasm_less,0.987788736820221,neutral
And that's how the streak ends....,3 stars,0.25141769647598267,sarcasm_less,0.9997225403785706,neutral
Johnson getting abused? I would've never guessed.,1 stars,0.3845556676387787,sarcasm_less,0.9999823570251465,neutral
But the rule of cool refs,3 stars,0.41504383087158203,sarcasm_less,0.8675225377082825,neutral
13 got beat. Drink.,5 stars,0.2780584990978241,sarcasm_less,0.9999880790710449,neutral
Just go for the TD come on,5 stars,0.27242133021354675,sarcasm_more,0.790351152420044,neutral
Hmm. What are we thinking? Laws of motion are interesting,3 stars,0.34811127185821533,sarcasm_less,0.999988317489624,neutral
we should change the frame of reference from the field to the passer on laterals,3 stars,0.36434251070022583,sarcasm_less,0.9981912970542908,neutral
"I would tend to agree. Can't say laterals happen all the much to matter nor will this call really affect the game in any way but from the reference of the QB that ball was lateraled behind him but because the football was still traveling at the speed of Bo Nix as he released it, the ball ended up ahead of the initial lateral from a sideline perspective.",2 stars,0.43808943033218384,sarcasm_less,0.9999914169311523,neutral
Nazeeh Johnson just gets abused out there.,1 stars,0.4677456319332123,sarcasm_less,0.9999884366989136,neutral
That was dumb. Eating a timeout.,1 stars,0.509148895740509,sarcasm_less,0.9999709129333496,neutral
you are out of your mind running rush plays that is absolutely how you get injured with people just flying all over the place uncontrolled,5 stars,0.3741948902606964,sarcasm_more,0.901491641998291,humorous
He would've got in tooðŸ˜­,3 stars,0.4024580121040344,sarcasm_less,0.9975975155830383,neutral
Matt Eberleflus was watching that last sequence and said to himself that he agreed with the decision not to call a timeout.,1 stars,0.2740620970726013,sarcasm_less,0.9999885559082031,neutral
Speedway is putting way too much money into advertising themselves as a place to get hot food.,2 stars,0.44809427857398987,sarcasm_less,0.9999825954437256,neutral
Wonder what the record for the quickest half of football is. Have a feeling this game is gonna be pushing for it in the second half,3 stars,0.2991306781768799,sarcasm_less,0.9999862909317017,neutral
"I'm so damn happy for Mike Evans. One of the best Aggies of all time, and I hope a future Hall of Fame member in the NFL.",5 stars,0.8735631108283997,sarcasm_less,0.9997542500495911,positive
"I want the chargers to lose the raiders game, but I do not think I can handle another Harbaugh match, where they inform us 350 times that they are brothers",3 stars,0.3634997308254242,sarcasm_less,0.9998360872268677,neutral
On the plus side there we get rid of one of the Harbaugh's after 1 week instead of having them both around.,3 stars,0.33676502108573914,sarcasm_less,0.9999885559082031,neutral
"but did you know they're the only coaching brother duo in NFL history? Let alone the only two to play against each other in Super Bowl history. They're the Kelces of coaching, or maybe we should say that the Kelces are the Harbaughs of football players.",3 stars,0.33221733570098877,sarcasm_more,0.9785366058349609,sarcastic
Are these the only 2 teams that have a current winning streak in the playoffs?,3 stars,0.3146737813949585,sarcasm_less,0.9998376369476318,neutral
Hearing romo suck off the ravens during a chiefs game?,1 stars,0.30799081921577454,sarcasm_less,0.9996019005775452,neutral
Is it illegal to have a team in the NFC south at double digit wins?,1 stars,0.48533985018730164,sarcasm_less,0.9996044039726257,neutral
Would you rather watch Carson wentz play qb full time or be a jets fan?,3 stars,0.302583783864975,sarcasm_less,0.9998376369476318,neutral
