body,sentiment_label,sentiment_score,sarcasm_label,sarcasm_score,classification
Broncos uniform choice sealed it before the game even started. No way you can lose in those jersrys,5 stars,0.3169500231742859,sarcasm_less,0.8699434399604797,neutral
They're just so damn good,5 stars,0.5933180451393127,sarcasm_less,0.6598448753356934,neutral
One of my favorite jersey/helmet combos of all time. I hated when they made the switch.,5 stars,0.9513320326805115,sarcasm_less,0.9999901056289673,positive
Look up their Super Bowl record when wearing orange uniforms lol,5 stars,0.3876236379146576,sarcasm_less,0.9996483325958252,neutral
This ain't the super bowl tho,1 stars,0.42141637206077576,sarcasm_less,0.9904897212982178,neutral
Those Denver uniforms are some of the best looking uniforms ever made That color combination is so clean,5 stars,0.8345844745635986,sarcasm_less,0.998518168926239,positive
Should have been their main uniforms.,3 stars,0.42048564553260803,sarcasm_less,0.9999852180480957,neutral
Should have been for the last 30 years. The 2000s and 2010s were mid af Our midnight blue alternates this year are fire though,2 stars,0.32831037044525146,sarcasm_less,0.9999908208847046,neutral
Really wish these were the defaults. Beautiful uniform matchup,5 stars,0.5063549876213074,sarcasm_less,0.9999861717224121,neutral
"I don't hate the new unis, but I do wish they'd go back to the royal blue. Navy/orange is so overdone",2 stars,0.3312169909477234,sarcasm_less,0.99998939037323,neutral
"Denver's throwbacks have gotta be top 3 cleanest uni's, right?",5 stars,0.5657054781913757,sarcasm_less,0.9993667006492615,neutral
They should be our regular again,3 stars,0.3149716854095459,sarcasm_less,0.9995393753051758,neutral
"I started watching in the 97 season (great choice) and remember always thinking the new at-the-time jerseys were so much better than the ""hideous"" 80s jerseys, but as time goes by retro keeps looking better and better",4 stars,0.38970425724983215,sarcasm_less,0.9994483590126038,neutral
Funny i feel that way about to non orange astros. Also the texans should wear the battle red most of the year if not in white,4 stars,0.4769250452518463,sarcasm_less,0.9999884366989136,neutral
Butker being too far left is a nice change of pace,3 stars,0.4849214553833008,sarcasm_less,0.999886155128479,neutral
"Every time Butker misses, a woman gets her college degree",5 stars,0.2975998520851135,sarcasm_less,0.999122679233551,neutral
"Obviously the Chiefs are resting people, but I'm glad Denver came out with energy, knew the stakes, and didn't play down knowing it's against 2nd stringers.",4 stars,0.4404795467853546,sarcasm_less,0.9999903440475464,neutral
Good teams are supposed to whoop 2nd stringers.,4 stars,0.5936633348464966,sarcasm_less,0.9999877214431763,neutral
I fully expect Sean and Andy to get on the same page in the 2nd half and we'll see full pre-season mode out there.,4 stars,0.344282329082489,sarcasm_less,0.999990701675415,neutral
"Yeah, neither team wants injuries here. Depth players (on the Chief's side) could wind up needing to step in in the playoffs (and obviously not everyone on the field is a pure backup), and you also have no reason to tip your hand strategically or schematically in a game like this. If you have a cool trick play dialed up, save it for the playoffs.",1 stars,0.37216395139694214,sarcasm_more,0.9838652014732361,sarcastic
There's a whole other half. Should never celebrate till the last whistle.,1 stars,0.5350428819656372,sarcasm_less,0.999971866607666,neutral
Man. Everyone in here talking shit that we didn't earn this blah blah not realizing that we haven't been to the playoffs in 8 years. WE DONT GIVE A FUCK! PLAYOFFS BABY!!!,1 stars,0.8495663404464722,sarcasm_more,0.83549964427948,neutral
Take the shit talk and enjoy. It means you're doing well.,4 stars,0.4955531060695648,sarcasm_less,0.9999910593032837,neutral
Idk how people can say that after Denver has rallied through the 2nd half of the season. Nix is a legitimate threat. GL in Buffalo boyos.,1 stars,0.5884676575660706,sarcasm_less,0.9998563528060913,neutral
As a bills fan I'm def worried. Denver is a pretty complete team. I'm just glad we're home where we're undefeated this year and everyone is relatively healthy for the first time.,5 stars,0.5378262400627136,sarcasm_less,0.9999861717224121,neutral
Strut your hoofs King,5 stars,0.4985792636871338,sarcasm_less,0.998770534992218,neutral
"Chris Colinsworth is somewhere yelling ""that reminds me of a guy I know -- Patrick Mahomes!""",1 stars,0.21463927626609802,sarcasm_less,0.999735414981842,neutral
"In this instance, if he compared it to Kelce it would be justifiable",3 stars,0.3363519012928009,sarcasm_less,0.9989387392997742,neutral
Are the bills worried? The broncos are dad dicking the 1 seed chiefs and the bills lost to who should of had the number pick. Find out next on first take,1 stars,0.3324262201786041,sarcasm_less,0.9999858140945435,neutral
"I mean, this is all KC backups. And means absolutely nothing. Also, what time did they arrive in Denver? I don't see Denver beating buffalo on the road.",1 stars,0.801417887210846,sarcasm_more,0.9988355040550232,sarcastic
Yeah i know but first take will have it open the show. Lol I think you guys have a chance. Your defense is good and might win a nail biter 34-31,4 stars,0.3755108118057251,sarcasm_less,0.999921441078186,neutral
Naw. We won't win a shootout. Gotta have the defense dominate and keep buffalo around 17-20 tops. Could it happen? Yes. Will it? I don't think so.,2 stars,0.4680628776550293,sarcasm_less,0.9998189806938171,neutral
Idk i think there is a chance. Allen has been amazing but i could just see a 3 interception game and your corners locking them down.,3 stars,0.38639554381370544,sarcasm_less,0.9999865293502808,neutral
Don't we all hope for that? Haha. Sounds like a perfect game for a PS2 pick six.,5 stars,0.6133556365966797,sarcasm_less,0.9767285585403442,neutral
Or 2 lol i think it will be a better match up because 1. You have the better defense 2. You have the better head coach You are just going against allen tho,3 stars,0.4431506097316742,sarcasm_less,0.9999886751174927,neutral
I mean the chiefs aren't starting very many defense starters are they?,2 stars,0.40461012721061707,sarcasm_less,0.999945878982544,neutral
No they aren't but that wont matter for talking points,2 stars,0.3353891968727112,sarcasm_less,0.9999179840087891,neutral
Not the first time Broncos did this to Chiefs this season.,2 stars,0.345223993062973,sarcasm_less,0.9999901056289673,neutral
All that matters is the win,5 stars,0.47824645042419434,sarcasm_less,0.9971319437026978,neutral
Rule of cool should apply here.,5 stars,0.38060295581817627,sarcasm_less,0.9999889135360718,neutral
i guarantee you did not say this when kelce lateraled last year vs. the bills.,3 stars,0.23751559853553772,sarcasm_less,0.9999904632568359,neutral
I'm pretty sure that's how I felt but this is also a very different situation (a game that is functionally meaningless for the Chiefs).,3 stars,0.5116961002349854,sarcasm_less,0.9999521970748901,neutral
Well I think it's safe to say nobody earned themselves a starting job today,5 stars,0.268536239862442,sarcasm_less,0.9369856119155884,neutral
0 INT game? Carson Wentz YOU are a Vegas Raider!,1 stars,0.8517815470695496,sarcasm_less,0.9998733997344971,neutral
Yeah because they weren't trying to play football at any point. Intentionally lost,1 stars,0.7581347823143005,sarcasm_more,0.8949242234230042,neutral
womp womp maybe win the games on your schedule so this cant happen,1 stars,0.371854692697525,sarcasm_less,0.7399443984031677,neutral
If it keeps triggering y'all I wish it were true. Your sub is priceless right now. Mythic copium.,1 stars,0.3713565468788147,sarcasm_less,0.9999843835830688,neutral
"Zach Wilson out? sorry broncos, maybe next season",1 stars,0.3722192347049713,sarcasm_less,0.9998866319656372,neutral
Fuck man that's it's pack it up there's no hope for the Sean Payton led broncos,1 stars,0.5153297185897827,sarcasm_more,0.9263204336166382,sarcastic
"Someone is face down, lifeless on the ground Nantz: ""he's shaken up""",1 stars,0.6946007609367371,sarcasm_less,0.9999524354934692,neutral
He rolled over face up by himself,1 stars,0.41680899262428284,sarcasm_less,0.9994730353355408,neutral
Why would the broncos give a fuck about the miami game?,1 stars,0.4228699803352356,sarcasm_less,0.9977218508720398,neutral
"We were wondering that also, this game is the only one that matters to them",1 stars,0.24239103496074677,sarcasm_less,0.9998852014541626,neutral
Broncos ðŸ¤ Chiefs trolling tantrum throwing Bengals fans,1 stars,0.3121807873249054,sarcasm_less,0.9884399175643921,neutral
No one picks on our AFCW little bros! ðŸ˜¤,5 stars,0.5477758049964905,sarcasm_less,0.9999233484268188,neutral
You know what Denver genuinely congrats. 10-7 is way above what I think anybody would've expected and you're clearly way ahead of schedule. Still think the Bills are going to eat your lunch next week though,3 stars,0.38607537746429443,sarcasm_less,0.9079279899597168,neutral
They most certainly will but I don't give a fuck I will gladly watch us get smacked 70-3 because we finally made the fucking playoffs,3 stars,0.2521911859512329,sarcasm_more,0.9998668432235718,sarcastic
"House money at this point. 20% of our cap is going to Russ this year, the fact we made the playoffs is so much better than I could have expected.",5 stars,0.49609896540641785,sarcasm_less,0.9999854564666748,neutral
"We were supposed to be a 4 win team, so this is fucking awesome. One blocked kick from sweeping the Chiefs and a REALLY weird OT from being 11-6.",5 stars,0.7191592454910278,sarcasm_more,0.6465235948562622,neutral
I actually had them in 2nd place on my preseason picks.. one win above chargers. I knew their defense is still very very good and bo just had to be average to have them competing for a WC. I was nearly spot on with the AFC playoffs.. except I had Bengals instead of Steelers... Didn't see their massive choke this season.,3 stars,0.34064939618110657,sarcasm_less,0.9999682903289795,neutral
"I am fully expecting this, my highest realistic hope is that we make it a good game.",5 stars,0.46097201108932495,sarcasm_less,0.9999891519546509,neutral
We all think that we will get brutalized by Buffalo next game. Our expectations are low but that just means there's a lot of room to be surprised.,3 stars,0.37453463673591614,sarcasm_less,0.999990701675415,neutral
"They very well might, but it'll be better than the Steelers play.",4 stars,0.5388273000717163,sarcasm_less,0.9999878406524658,neutral
About 6 more wins than most media gave us credit for to start the year,3 stars,0.2699466049671173,sarcasm_less,0.999396800994873,neutral
Buffalo just lost to New England. They wont make it far in playoffs,2 stars,0.30795910954475403,sarcasm_less,0.9999905824661255,neutral
Hopefully Trubisky starts next week,3 stars,0.2975369989871979,sarcasm_less,0.9989629983901978,neutral
CBS doesn't care about Broncos fans wanting to see their team make the playoffs for the first time in like 9 years apparently,1 stars,0.4855101704597473,sarcasm_more,0.6924811601638794,neutral
Suits fucked up,1 stars,0.2975289225578308,sarcasm_less,0.9930236339569092,neutral
I'm glad I did the $5 Sunday Ticket deal for today so I can switch to that... What a gigantic fuck you to the average viewer though,3 stars,0.242570161819458,sarcasm_less,0.771811306476593,neutral
Bengals are 18-16 since the Burrowhead statement,3 stars,0.264196515083313,sarcasm_less,0.9984911680221558,neutral
"I misread this as ""Burrowhead Incident"" and want to canonize it that way in my head",1 stars,0.5532227158546448,sarcasm_less,0.9999264478683472,neutral
Our point differential is going to be fucking hilarious lmao.,5 stars,0.24406616389751434,sarcasm_more,0.7488914132118225,neutral
What was it coming in? Still gonna be positive?,3 stars,0.3316067159175873,sarcasm_less,0.999880313873291,neutral
"It was 97 coming into this, so still in the positives but cut right down.",3 stars,0.36566540598869324,sarcasm_less,0.999982476234436,neutral
I think it stands at +59 right now,5 stars,0.277116596698761,sarcasm_less,0.9972838163375854,neutral
Who did you destroy to get to 97? Didn't you win like 12 walkoffs??,1 stars,0.5785840749740601,sarcasm_more,0.7039191126823425,neutral
Few two score wins in the last three weeks helped a lot. Think we only had 5 wins that were either a walkoff FG or a kneel down 3 points or under. The one score games added up.,3 stars,0.4196230173110962,sarcasm_less,0.9999901056289673,neutral
The 3 games in 10 day stretch that everyone thought was going to kill us actually pushed our point differential up.,5 stars,0.28741756081581116,sarcasm_less,0.9999878406524658,neutral
Bengals fans rooting harder for the chiefs and jets today then the chiefs and jets fan are ðŸ’€,3 stars,0.29516711831092834,sarcasm_less,0.9996451139450073,neutral
Here with my bi-annual reminder that the Broncos need to make their throwbacks their primary jerseys.,4 stars,0.40979599952697754,sarcasm_less,0.9999903440475464,neutral
"We need to wear these uniforms every game, and possibly even days where we have no game.",5 stars,0.5646768808364868,sarcasm_less,0.9999897480010986,neutral
Giving Romo a Chiefs game without Mahomes is like a kid getting excited for Christmas but then not getting any gifts.,3 stars,0.3102002739906311,sarcasm_less,0.99998939037323,neutral
Not that it stops him from glazing.,2 stars,0.36916524171829224,sarcasm_less,0.9977884292602539,neutral
You really painted a picture here,5 stars,0.455985963344574,sarcasm_less,0.9998714923858643,neutral
Lol Bengals fans just turn off the TV now.,1 stars,0.46199679374694824,sarcasm_less,0.9999645948410034,neutral
The Chiefs black magic has been transferred to the Broncos just to screw the Bengals lol,4 stars,0.23648589849472046,sarcasm_less,0.877403736114502,neutral
Someone tell cbs the dolphins-jets game doesn't affect us at all at this point.,1 stars,0.5041046142578125,sarcasm_less,0.9999898672103882,neutral
"Right? I can't tell if they just keep forgetting or trying to keep interest up. Like, we don't care at all about the Jets/Dolphins outcome",2 stars,0.3518233299255371,sarcasm_less,0.9982206225395203,neutral
"Yeah I could understand if they were giving the updates for bengals fans, but they kept saying ""broncos fans might want to watch this one"" or something like that.",2 stars,0.2922510504722595,sarcasm_less,0.9999806880950928,neutral
It should be legal on the fact that it looked cool,3 stars,0.35129866003990173,sarcasm_less,0.9971646666526794,neutral
This is my take 100%.,5 stars,0.9519895315170288,sarcasm_less,0.9982476234436035,positive
"Bengals fans: ""DENVER ISN'T GONNA LET US MAKE THE PLAYOFFS?!?!"" ðŸ˜ ðŸ˜¡ðŸ¤¬ [Me:](",1 stars,0.3735605478286743,sarcasm_less,0.9971638321876526,neutral
How have I gone my entire life as a known meme enjoyer without seeing this Thank you so much,5 stars,0.8035827279090881,sarcasm_less,0.850802481174469,positive
These Broncos unis might be my most favorite in the league.,5 stars,0.6522343754768372,sarcasm_less,0.9999871253967285,neutral
This is the stat pad game of all stat pad games.,5 stars,0.7988748550415039,sarcasm_less,0.9999878406524658,neutral
We should have pulled Nix at 17/17 and 3 TDs.,1 stars,0.41136839985847473,sarcasm_less,0.9999902248382568,neutral
I want to watch the Chiefs get shut out I don't give a fuck about the raiders,1 stars,0.6596730351448059,sarcasm_less,0.9973741769790649,neutral
The rating must've been plummeting lol,2 stars,0.31679022312164307,sarcasm_less,0.9970610737800598,neutral
CBS I DIDNT ASK FOR YOUR OPINION ON WHICH GAME IS BETTER,3 stars,0.28093817830085754,sarcasm_less,0.9993509650230408,neutral
It's been said many times but damn those Denver jerseys are sharp,3 stars,0.36779090762138367,sarcasm_less,0.9567350745201111,neutral
"The horse is so much better, the other one looks like it has been pepper sprayed.",2 stars,0.49910038709640503,sarcasm_less,0.9999877214431763,neutral
Old school from orange crush days....,5 stars,0.4062340557575226,sarcasm_less,0.9334333539009094,neutral
My non-Nebraska family in CO had posters and memorabilia with these jerseys all over. Always thought they were really cool,5 stars,0.523030161857605,sarcasm_less,0.9999897480010986,neutral
"Reminds of Steve Atwater, one of my favorite players as a kid. Those uniforms are sweet as hell.",5 stars,0.6775986552238464,sarcasm_less,0.9966199398040771,neutral
im starting to think the bengals arent making the playoffs.....,2 stars,0.33596208691596985,sarcasm_less,0.9985207915306091,neutral
If Mike pence has the courage to do the right thing,3 stars,0.2938307523727417,sarcasm_less,0.9751750826835632,neutral
"3 AFCW teams in the playoffs, hilarious the raiders were left out",5 stars,0.3521150052547455,sarcasm_less,0.9997250437736511,neutral
Feel bad for teams in that situation. Looks like it's them and the Bears,2 stars,0.44176745414733887,sarcasm_less,0.9999886751174927,neutral
I can't believe Bo Nix was able to accurately predict how that ball would be tipped multiple times into the hands of Vele,1 stars,0.3922934830188751,sarcasm_less,0.9988038539886475,neutral
Rule of cool should prevail here.,4 stars,0.3677683472633362,sarcasm_less,0.9999887943267822,neutral
This game is gonna make our point differential stat even funnier lol,5 stars,0.687549889087677,sarcasm_less,0.9989681243896484,neutral
"you need to lose by enough that it goes negative for the year, would make your w:l even more confusing.",2 stars,0.43448784947395325,sarcasm_less,0.9999914169311523,neutral
The Chiefs point differential is gonna be historically bad for a 15 win team,2 stars,0.37460318207740784,sarcasm_less,0.9907599687576294,neutral
We're making history,5 stars,0.5378382205963135,sarcasm_less,0.9964009523391724,neutral
It'll probably be a very long-lasting record.,3 stars,0.4584469497203827,sarcasm_less,0.9999873638153076,neutral
I feel like it's strategic by the Chiefs because they want Denver in the playoffs.,4 stars,0.4605354368686676,sarcasm_less,0.9999896287918091,neutral
I don't give a crap if it's the backup. This is cathartic.,1 stars,0.4412793219089508,sarcasm_less,0.9999445676803589,neutral
I love watching our guys having fun in the last week of the regular season! Much better than week 17 last season with Russ.,5 stars,0.8192427158355713,sarcasm_less,0.9999902248382568,positive
At least you guys can beat our third stringers,1 stars,0.26033470034599304,sarcasm_less,0.9836874008178711,neutral
"Instead of a Coach's Challenge. Each team should be allowed one ""Rule of Cool"" play per game. Throw your flag, play stands no matter what because it was fucking sweet.",1 stars,0.5057728290557861,sarcasm_more,0.7954015731811523,neutral
Honestly I could get behind this,3 stars,0.2545345425605774,sarcasm_less,0.7413825988769531,neutral
"I don't think KC has challenged either play reviewed so far. They just got the first one for free, this is at least under 2 minutes.",2 stars,0.4036540985107422,sarcasm_less,0.9999901056289673,neutral
I don't ever remember commentators talking about guys getting performance bonuses as much as they have this weekend.,5 stars,0.6635921597480774,sarcasm_less,0.9999887943267822,neutral
I'd imagine is a natural progression of fantasy and betting.,5 stars,0.4575851857662201,sarcasm_less,0.9999895095825195,neutral
DOGSHIT clock management. why are NFL teams soo fucking bad at this shit?!,1 stars,0.8455362915992737,sarcasm_more,0.9787004590034485,sarcastic
It's been said before but nfl teams need to hire some 15 year old madden pro just to manage the clock.,3 stars,0.42274707555770874,sarcasm_less,0.9999872446060181,neutral
I honestly could do a better job. Im not even kidding. They are all beyond horrific.,1 stars,0.41672298312187195,sarcasm_less,0.9907450675964355,neutral
That made no sense to me.,1 stars,0.4536479711532593,sarcasm_less,0.9999886751174927,neutral
Imagine Chiefs come back and win 27-24 and all the Bengals fans lose it and go crazy only for Dolphins to kick a game winning field goal 5 minutes later,1 stars,0.5400442481040955,sarcasm_more,0.8793410658836365,neutral
Thanks for planting this idea in my brain. Now I'm going to be even more upset.,5 stars,0.43955472111701965,sarcasm_less,0.9999885559082031,neutral
Par for the course,4 stars,0.4063659906387329,sarcasm_less,0.9985395669937134,neutral
Best case scenario as far as I'm concerned. ðŸ˜€,5 stars,0.8177865147590637,sarcasm_less,0.9999792575836182,positive
If the fucking Chiefs are only the second team to drop a donut this year people are gonna lose their minds lmao,1 stars,0.6257466077804565,sarcasm_more,0.9996125102043152,sarcastic
Really tanking our net points to add to the narrative.,5 stars,0.5945107340812683,sarcasm_less,0.9999182224273682,neutral
They are just charging up their points for the playoffs,5 stars,0.38355356454849243,sarcasm_less,0.9950534701347351,neutral
RIP Mayo. Why did they announce that like he died lol,1 stars,0.6987495422363281,sarcasm_less,0.9973893761634827,neutral
Breaking news: Jerod Mayo's coaching career has tragically died,1 stars,0.5344383120536804,sarcasm_less,0.9999428987503052,neutral
I walked in the room as they were showing that and was VERY confused lol,1 stars,0.47859951853752136,sarcasm_less,0.9998045563697815,neutral
"I wasn't paying attention and heard ""breaking news"" and a dude's somber sounding voice and was so concerned at first lol",1 stars,0.4089207351207733,sarcasm_less,0.9999563694000244,neutral
This game could have been an email,1 stars,0.40965941548347473,sarcasm_less,0.9902626276016235,neutral
it almost was for a moment when KC was stranded at KCI due to the weather.,2 stars,0.3563550114631653,sarcasm_less,0.9999892711639404,neutral
KC scheduling their plane trip like me when I don't want to do something and are looking for any excuse to get out of it.,5 stars,0.3826551139354706,sarcasm_less,0.9999899864196777,neutral
Can you imagine how salty Bengals fans would be if KC had to forfeit due to weather?,3 stars,0.27413299679756165,sarcasm_less,0.9996809959411621,neutral
This is an ego stroke game for Sean Payton,5 stars,0.33567339181900024,sarcasm_less,0.9806890487670898,neutral
Broncos fans you've waited 8 years to see your team make the playoffs! Sucks for you here's the raiders fighting for draft position,1 stars,0.5746727585792542,sarcasm_less,0.9912307262420654,neutral
Time to sail the high seas,5 stars,0.45184996724128723,sarcasm_less,0.9947984218597412,neutral
FUCK YES CBS!!!!,1 stars,0.8398126363754272,sarcasm_less,0.9267705678939819,neutral
"Did CBS really decide ""fuck it, lets just switch game""?",1 stars,0.6553434729576111,sarcasm_less,0.9826344847679138,neutral
"ngl feel a little bad for the chiefs who played today. they probably spend all season saying 'if only i got a chance, id show them what im made of', and they find out they aren't made of much.",3 stars,0.4782136082649231,sarcasm_less,0.9999905824661255,neutral
This game was a good reminder of how things used to be.,4 stars,0.5345889329910278,sarcasm_less,0.9999885559082031,neutral
Yes same here. Broncos kicking the dick off the chiefs. The other two teams in our division just...being there stinking up the afc west,1 stars,0.3219136893749237,sarcasm_more,0.9564707279205322,sarcastic
"I can see Denver upsetting Buffalo. - Everyone in the league is familiar with the Bills, the Bills are not familiar with the Broncos - Payton>>>>>McDermott as a coach, if the game is close, I bet on Payton Would I put money on it? No. But I think it'll be a closer game than people think. Denver is not just gonna be fed to Buffalo.",2 stars,0.3075370192527771,sarcasm_less,0.9999912977218628,neutral
"We went up there last year and won. It's not impossible, just highly improbable lol.",1 stars,0.5287047624588013,sarcasm_less,0.9999905824661255,neutral
"Denver could upset Buffalo, but because they don't have ""stars"" everyone thinks they are overrated. I'm a Bills fan but realistic and the team this year can play anyone.",3 stars,0.26694145798683167,sarcasm_less,0.9999896287918091,neutral
"I honestly don't think we match up well against the bills, crazier things have happened though ðŸ¤·",3 stars,0.4700503647327423,sarcasm_less,0.9996579885482788,neutral
"I hear where you're coming from, but I put far more faith in Josh Allen than Bo Nix.",3 stars,0.3180696964263916,sarcasm_less,0.9999897480010986,neutral
Not surprised we dog walked them on there turf last time. They aren't that good,2 stars,0.5050424933433533,sarcasm_less,0.9999885559082031,neutral
The salt for KC/DEN III if Buffalo shits the bed will be heard nationwide.,4 stars,0.32786324620246887,sarcasm_less,0.9999897480010986,neutral
"I'm enjoying the three way knife fight between broncos, chiefs and bengals fans that's going on in this thread",4 stars,0.5721399784088135,sarcasm_less,0.9996470212936401,neutral
Bengals have all their hopes in 2nd string Chiefs which is already a terrible place to be.,5 stars,0.31960758566856384,sarcasm_less,0.9999895095825195,neutral
Bills and ravens fans are somewhere crying about an mvp award,5 stars,0.2640841007232666,sarcasm_less,0.9978177547454834,neutral
"You don't understand, Mahomes and Reid are suuuuupppppeeeerrrr spooked by the Bengals",1 stars,0.49845898151397705,sarcasm_more,0.9358848333358765,sarcastic
Chiefs brought their spoon instead,1 stars,0.36189624667167664,sarcasm_less,0.9990503191947937,neutral
"I paid $4.99 for this game!!! Give it back, YouTube!",1 stars,0.8922863602638245,sarcasm_less,0.9999881982803345,neutral
"Im loving this game thread as a neutral, good to see Broncos back in the playoffs",5 stars,0.5822981595993042,sarcasm_less,0.999795138835907,neutral
I have a feeling the Lions/Vikes thread isn't gonna be as fun.,3 stars,0.5957161784172058,sarcasm_less,0.9999889135360718,neutral
