body,sentiment_label,sentiment_score,sarcasm_label,sarcasm_score,classification
Congrats on making the playoffs for the first time in a decade. I'll be back next week and save your seat on the couch for the divisional round,4 stars,0.255109965801239,sarcasm_less,0.9999891519546509,neutral
You and i don't sit together. We have SB wins you don't. You're a little lower on the totem pole,2 stars,0.38854140043258667,sarcasm_less,0.9999897480010986,neutral
Lmao. Bro took an L to burrow and is taking an L to Allen next week. Broncos are irrelevant. Pretty sad life you have,1 stars,0.5300086736679077,sarcasm_less,0.9999572038650513,neutral
If the Broncos are irrelevant the Bengals are non existent. Bo didn't lose to Jacoby BrissetðŸ˜­ðŸ˜­ðŸ˜­,1 stars,0.3340694308280945,sarcasm_less,0.999748170375824,neutral
Bo lost to Burrow that's all that matters.,4 stars,0.26294705271720886,sarcasm_less,0.9999881982803345,neutral
It doesn't matter. He lost to Burrow and still made playoffs i think he'll be aight,3 stars,0.35372504591941833,sarcasm_less,0.9999878406524658,neutral
At least we have a shot. Enjoy the couch. Enjoy your dipshit owner pissing away the only competent team you've had in 40 years,5 stars,0.41828373074531555,sarcasm_more,0.9637948274612427,humorous
I'll save a seat for you when you're blown out in Buffalo.,1 stars,0.23137415945529938,sarcasm_less,0.9999885559082031,neutral
No thanks I only sit next to Super Bowl winners.,1 stars,0.621157169342041,sarcasm_less,0.9999719858169556,neutral
That's probably why you suck off Mahomes a lot isn't it,2 stars,0.35069525241851807,sarcasm_less,0.9950457811355591,neutral
No that's cause he was MVP.,1 stars,0.2471918910741806,sarcasm_less,0.9999196529388428,neutral
GOOD MORNING CINCINNATI. (we are getting blown out),5 stars,0.46993914246559143,sarcasm_less,0.9999881982803345,neutral
What time zone are you in?,3 stars,0.224127396941185,sarcasm_less,0.9991377592086792,neutral
It's morning somewhere,3 stars,0.2739676237106323,sarcasm_less,0.9940377473831177,neutral
I like those Denver throwbacks. ðŸ‘,5 stars,0.5708547830581665,sarcasm_less,0.9999889135360718,neutral
They are so much better than their current unis.,5 stars,0.7464905381202698,sarcasm_less,0.9999823570251465,neutral
The Denver throwbacks look good,4 stars,0.4723881185054779,sarcasm_less,0.9965165853500366,neutral
"Don't know how whoever makes the decision on uniforms can look at these, look at the regular ones, and decide not to go with these.",2 stars,0.31227216124534607,sarcasm_less,0.9999890327453613,neutral
Please go back to these uniforms full time I beg of you,5 stars,0.4402341842651367,sarcasm_less,0.9830991625785828,neutral
Not a great start for Cincy,2 stars,0.5059821605682373,sarcasm_less,0.9960770010948181,neutral
is it safe to assume the chiefs are going to let the broncos win by 30?,3 stars,0.3491523563861847,sarcasm_less,0.9999362230300903,neutral
Why am I watching a Boise State game?,1 stars,0.35760292410850525,sarcasm_less,0.9994984865188599,neutral
lets go broncos!,5 stars,0.597207248210907,sarcasm_less,0.9999110698699951,neutral
I'm okay with losing but god damnit don't make it easy on them...,3 stars,0.6730306148529053,sarcasm_less,0.7802944183349609,neutral
Sell the team Bengals,1 stars,0.5409772992134094,sarcasm_less,0.997412383556366,neutral
"**IN COM PLETE** lol, I know y'all hate it.",1 stars,0.7590665221214294,sarcasm_less,0.9997251629829407,neutral
Unpopular opinion but the Skol horn is more annoying than the bronco neigh or the charger charge noise.,2 stars,0.42088353633880615,sarcasm_less,0.9999898672103882,neutral
How about all three are annoying,2 stars,0.4328605532646179,sarcasm_less,0.999010443687439,neutral
Yeah you don't have to listen to the Viking horn every 2 seconds. Come to the nfc north for a year and you'll chance your tune.,1 stars,0.38913804292678833,sarcasm_less,0.6691368222236633,neutral
This game is absolute uniform porn,5 stars,0.6994935870170593,sarcasm_more,0.7791401743888855,neutral
"It really is. As triggering as your throwbacks are, they are a fantastic uniform",5 stars,0.836550235748291,sarcasm_less,0.9999521970748901,positive
I liked the BYU-Utah game from a few weeks back. Solid red uniforms against solid blue uniforms.,4 stars,0.5426090359687805,sarcasm_less,0.9999905824661255,neutral
We in our throw backs too,5 stars,0.40605875849723816,sarcasm_less,0.9976531863212585,neutral
Yah but the whole world wants to fast forward to Vikings vs Lions,3 stars,0.4566161334514618,sarcasm_more,0.820978581905365,neutral
Being a team that needs Wentz to get a win so you can get in the playoffs is nasty business,4 stars,0.343425989151001,sarcasm_less,0.9627726078033447,neutral
"It's funny that the NFL scroll describes the Packers losing to the Bears as ""clinching the 7 seed""",4 stars,0.29318830370903015,sarcasm_less,0.9997389912605286,neutral
Yeah that's pretty weird,3 stars,0.4401673972606659,sarcasm_less,0.957697868347168,neutral
Not off to a good start lol,1 stars,0.3306361734867096,sarcasm_less,0.9987762570381165,neutral
I think it's going well.,4 stars,0.5353977680206299,sarcasm_less,0.9999884366989136,neutral
That's what the Bengals get for losing all of those close games,3 stars,0.317441463470459,sarcasm_less,0.9948295950889587,neutral
"Announcers are funny, they are fighting for their playoff life and they don't think they were going to go for it against backups",4 stars,0.4555276334285736,sarcasm_less,0.9989504814147949,neutral
I fucking love these broncos uniforms,5 stars,0.8836051225662231,sarcasm_less,0.9336286783218384,positive
Can we start a petition league wide to make them their standard uniforms?,1 stars,0.25938600301742554,sarcasm_less,0.9998905658721924,neutral
Id sign it,1 stars,0.22857047617435455,sarcasm_less,0.9950681924819946,neutral
I'd say the Broncos would like to go playoffing,3 stars,0.3499615490436554,sarcasm_less,0.9944940209388733,neutral
*flips to Redzone*,1 stars,0.2669306695461273,sarcasm_less,0.9998164772987366,neutral
Fuck that was dangerous,1 stars,0.8436841368675232,sarcasm_less,0.9289748072624207,neutral
Sorry Bengals bros...,1 stars,0.5296092629432678,sarcasm_less,0.993804931640625,neutral
Sean Peyton looking like Elton John out there.,4 stars,0.26400160789489746,sarcasm_less,0.9999901056289673,neutral
Sutton is my favorite WR that is probably outside the top 10 guys. Glad he finally has a good QB,5 stars,0.7381278872489929,sarcasm_less,0.9999892711639404,neutral
"He's very good as a contest catch, possession WR. Denver figuring out who to utilize both him and a speed guy like Mims has really helped the offense",4 stars,0.5434046983718872,sarcasm_less,0.9999901056289673,neutral
Told y'all the Chiefs are overrated!,1 stars,0.6018925905227661,sarcasm_less,0.999664306640625,neutral
"And now we've swapped to our backup O-Line. We ain't scoring this game I don't think, lol",1 stars,0.5340567231178284,sarcasm_less,0.999876856803894,neutral
Lmao that graphic,3 stars,0.2563420236110687,sarcasm_more,0.5206465125083923,neutral
lol three flags thrown,1 stars,0.6333633661270142,sarcasm_less,0.9828444719314575,neutral
Good season my fellow Bengals fans! Let's not start 4-8 next season maybe,4 stars,0.5808483362197876,sarcasm_less,0.9996993541717529,neutral
And we can shit on the D and coaching but the O could've put up more than 10 points against the bloody Pats,3 stars,0.35061243176460266,sarcasm_more,0.9356229305267334,sarcastic
Yup. They started out ludicrously unprepared. That's on everyone - even Burrow,1 stars,0.49591848254203796,sarcasm_more,0.9994932413101196,sarcastic
I wish the broncos still had these as their primary uniforms. I loved them as a kid and hated when they changed them,4 stars,0.364247590303421,sarcasm_less,0.9999903440475464,neutral
I feel like I'm watching a high school offense right now lmao,5 stars,0.2501552104949951,sarcasm_less,0.999582827091217,neutral
"Wentz hasn't started in a while, give it time",4 stars,0.38267678022384644,sarcasm_less,0.9995125532150269,neutral
This game should have just been a forfeit.,1 stars,0.609852135181427,sarcasm_less,0.9999885559082031,neutral
Damn I dont even know half of the people playing today lmao,1 stars,0.41174840927124023,sarcasm_less,0.9515866041183472,neutral
And youre a chiefs fan?,1 stars,0.2797468304634094,sarcasm_less,0.9998937845230103,neutral
Quick name your third string defensive tackle!,5 stars,0.7400062680244446,sarcasm_less,0.9997357726097107,neutral
Team rosters aren't that big. It's not difficult to know the players,3 stars,0.5657515525817871,sarcasm_less,0.9999858140945435,neutral
I'm genuinely upset we're only getting to see Joshue Uche snaps today. Like... we could've used him while Omenihu was out!,1 stars,0.5675603747367859,sarcasm_less,0.9555701017379761,neutral
Is Denver finally switching to these uniforms full time? 1000x better than the other ones.,5 stars,0.46665459871292114,sarcasm_less,0.9999866485595703,neutral
Lmao I always love the 10 yards down the field fake throw,5 stars,0.6942039728164673,sarcasm_less,0.9885439276695251,neutral
I'm thinking the same fucking thing...,1 stars,0.658803403377533,sarcasm_less,0.9838711023330688,neutral
Why the hell do they keep saying broncos paying attention to Miami game. Miami is irrelevant to broncos..,1 stars,0.6607600450515747,sarcasm_less,0.9999326467514038,neutral
Because this weekend sucks dick and they need to maintain viewer engagement,1 stars,0.39017772674560547,sarcasm_more,0.9735403656959534,sarcastic
Oh my God Nate. Again. Broncos fans don't care about the Dolphins game,1 stars,0.465725839138031,sarcasm_less,0.6150474548339844,neutral
The game break guy is an idiot. Why does he keep saying the Broncos are paying attention to the Miami game? That game has zero affect on the Broncos,1 stars,0.7388030886650085,sarcasm_less,0.9999581575393677,neutral
Is Romo fucking blind?,1 stars,0.6039795279502869,sarcasm_less,0.9943761825561523,neutral
Ehhh uhhhh ehhh I don't know Jim,2 stars,0.32667189836502075,sarcasm_less,0.9121414422988892,neutral
Should be inches not 1 yard,1 stars,0.3902233839035034,sarcasm_less,0.9984198808670044,neutral
Andy needs to let Wentz off the leash next possession. Might as well go out on your shield,3 stars,0.3803935647010803,sarcasm_less,0.9999896287918091,neutral
OH MY GOD,5 stars,0.5848686099052429,sarcasm_less,0.7831491827964783,neutral
Well if that ain't some shit,3 stars,0.3781903386116028,sarcasm_more,0.8441379070281982,neutral
Wow like 3 people almost had that,5 stars,0.5390326976776123,sarcasm_less,0.7430294752120972,neutral
lmao thats incredible.,5 stars,0.7209988236427307,sarcasm_less,0.9999048709869385,neutral
Lmfao that's insane,1 stars,0.4357139766216278,sarcasm_more,0.8580290675163269,neutral
Holy fuckin shut,1 stars,0.7285088300704956,sarcasm_more,0.5165156126022339,neutral
okay that was pretty cool lol,3 stars,0.7855801582336426,sarcasm_less,0.983497142791748,neutral
Man why can't weird shit like that happen when the chiefs have their starters in,1 stars,0.2554408013820648,sarcasm_less,0.5473456382751465,neutral
"It does, just in the Chiefs favor lol.",3 stars,0.5323314666748047,sarcasm_less,0.9999723434448242,neutral
What the actual horsey magic ðŸ’€,5 stars,0.6068640947341919,sarcasm_more,0.9944673776626587,humorous
Good extra effort vele,4 stars,0.5315484404563904,sarcasm_less,0.9959521293640137,neutral
#THAT WAS SOOOOOO FUCKING AWESOME!!!!,5 stars,0.7972161173820496,sarcasm_more,0.9894468784332275,humorous
Chief's vodo spilling over and going to Broncos.,1 stars,0.48359304666519165,sarcasm_less,0.9999880790710449,neutral
Double Doink? No. Double Deflection? Yes,1 stars,0.49796441197395325,sarcasm_less,0.9999887943267822,neutral
3 more tds to tie the overall record,5 stars,0.4315289258956909,sarcasm_less,0.9983275532722473,neutral
Bo Nix certified that guy pal,1 stars,0.3747822642326355,sarcasm_more,0.9101660251617432,sarcastic
Let's see how he does next week in Buffalo.,4 stars,0.4121522009372711,sarcasm_less,0.9999885559082031,neutral
wait so does this mean we get to call them frauds in the post-game thread?,1 stars,0.5222359299659729,sarcasm_less,0.9998080134391785,neutral
Hell yea go for it,5 stars,0.27405107021331787,sarcasm_less,0.5496907234191895,neutral
Nix is 17/17,1 stars,0.5035274624824524,sarcasm_less,0.993466317653656,neutral
That was fucking wild,1 stars,0.4362775981426239,sarcasm_more,0.7687876224517822,neutral
Can we at least trade the Texans for the Bengals in the playoffs?,1 stars,0.32117295265197754,sarcasm_less,0.9997459053993225,neutral
STOP ESTABLISHING THE RUN FREE CARSON WENTZ,1 stars,0.3983176648616791,sarcasm_less,0.9977957010269165,neutral
Chiefs are playing like they got told not to hurt themselves trying too hard,5 stars,0.48480600118637085,sarcasm_less,0.9960440397262573,neutral
That's exactly what they were told,5 stars,0.36349204182624817,sarcasm_less,0.9615852236747742,neutral
"There's 0 point to getting any players hurt, even second stringers.",1 stars,0.8539626002311707,sarcasm_less,0.9999889135360718,neutral
"Explain Rodgers getting his 500th td again, but with those nuggies",3 stars,0.2696813642978668,sarcasm_less,0.9819874167442322,neutral
Carson wentz is just not an NFL caliber QB,1 stars,0.41890573501586914,sarcasm_less,0.9959369897842407,neutral
He looks like Tom Brady when compared to Zappe & Dorian Thompson Robinson,3 stars,0.3671054542064667,sarcasm_less,0.9992908239364624,neutral
Give him kelce and rice and he is!,5 stars,0.6508823037147522,sarcasm_less,0.9999392032623291,neutral
And Hunt and Pacheco.,5 stars,0.45648908615112305,sarcasm_less,0.9999865293502808,neutral
Never had the making of a varsity athlete,1 stars,0.29607483744621277,sarcasm_less,0.9914475679397583,neutral
"small hands, that was his problem",3 stars,0.39472392201423645,sarcasm_less,0.9999628067016602,neutral
Did we send Raytown South to Denver?,1 stars,0.3850090503692627,sarcasm_less,0.9995865225791931,neutral
Why hate on Ray South?,1 stars,0.4675966501235962,sarcasm_less,0.9992764592170715,neutral
No disrespect to the fine people of Raytona Beach,4 stars,0.3443203568458557,sarcasm_less,0.9937611222267151,neutral
With how the chiefs are playing is it safe to say Hopkins isn't getting his TD for his incentive?,3 stars,0.3201843202114105,sarcasm_less,0.9999030828475952,neutral
Hopkins ain't even in,1 stars,0.4974637031555176,sarcasm_less,0.9230331182479858,neutral
Oh wow. That sucks for him,1 stars,0.6066729426383972,sarcasm_more,0.8385019302368164,neutral
He's made a lot of money but doesn't have a ring. Seems like his goal is in line with the rest of the team,3 stars,0.5046160817146301,sarcasm_less,0.9999898672103882,neutral
Kc is pretty good about paying the incentives if you get close/ don't play because we sat you/ him not playing also makes the draft pick trade lower so,3 stars,0.4611488878726959,sarcasm_less,0.999627947807312,neutral
"One of his incentives is getting a TD, so they could put him in for a goal line play if they ever get there.",4 stars,0.4668971598148346,sarcasm_less,0.9999887943267822,neutral
I don't think he is but he's such a red zone threat so who knows...,3 stars,0.2833785116672516,sarcasm_less,0.998847246170044,neutral
Why the fuck do they keep mentioning the broncos watching the Miami game closely and worried?! Are they stupid?,1 stars,0.7611437439918518,sarcasm_less,0.9985836744308472,neutral
Short answer yes long answer is also yes,3 stars,0.3117721676826477,sarcasm_less,0.9970893263816833,neutral
Wentz has the worst pocket awareness of any qb I have ever seen,1 stars,0.7942038178443909,sarcasm_less,0.9956467747688293,neutral
Caleb Williams might be worse,3 stars,0.38256484270095825,sarcasm_less,0.9979748129844666,neutral
Yeah whoever said wentz is a starting caliber qb is just wrong,1 stars,0.57261723279953,sarcasm_less,0.9383956789970398,neutral
"""Somehow Wentz didn't fumble the ball."" I'm shocked too.",2 stars,0.29796674847602844,sarcasm_less,0.9999843835830688,neutral
I have to say that Nix really surprised me this season. I underestimated him i didn't think that he would have a season like this. Nice to see he seems like a nice guy.,3 stars,0.4109783172607422,sarcasm_less,0.9999902248382568,neutral
butker aint been the same since coming back,1 stars,0.3020329773426056,sarcasm_less,0.9969087243080139,neutral
Has Butker been really shaky since coming back from injury?,2 stars,0.3741295337677002,sarcasm_less,0.9998860359191895,neutral
Yes and it's awesome,5 stars,0.8368592858314514,sarcasm_less,0.9958922863006592,positive
wtf I love Bo Nix now?,5 stars,0.33643850684165955,sarcasm_less,0.9997888207435608,neutral
"Now they're just stunting on them. Might be forward, but all of the angles of the replay have been ass.",2 stars,0.433883398771286,sarcasm_less,0.9999858140945435,neutral
It went like 3 yards forward,1 stars,0.4114266335964203,sarcasm_less,0.9988858103752136,neutral
"Hey, we don't get to stunt on KC often.",3 stars,0.32552656531333923,sarcasm_less,0.999312162399292,neutral
Alright where's the physics major cause he truly threw that backwards but his moment was more foward,3 stars,0.5419249534606934,sarcasm_more,0.5347741842269897,neutral
"If you're running forwards faster than you throw the ball backwards, it turns out the ball will still go forwards",3 stars,0.3738408386707306,sarcasm_less,0.9989511966705322,neutral
<-- <-- <-- --> --> Turns <--,3 stars,0.28160005807876587,sarcasm_less,0.9977333545684814,neutral
"Boo, let it stand. The rule of cool",5 stars,0.4472888112068176,sarcasm_less,0.9133492708206177,neutral
Dude it was cool. It should be legal.,3 stars,0.31587478518486023,sarcasm_less,0.99998939037323,neutral
lol refs working overtime in week 18,4 stars,0.2509829103946686,sarcasm_less,0.9860516786575317,neutral
Football has too many fucking procedural rules. If it takes you a minute to explain what the fuck just happened there's something fundamentally wrong.,1 stars,0.6245318651199341,sarcasm_less,0.9999097585678101,neutral
Bengals blew it by losing to the patriots lmao,1 stars,0.3588207960128784,sarcasm_less,0.9188349843025208,neutral
"ref: the ruling is ""come on just...dont make me look all this up its my week 18 too""",1 stars,0.35332387685775757,sarcasm_more,0.6683308482170105,neutral
This broncos team is fun,4 stars,0.4853602945804596,sarcasm_less,0.9964305758476257,neutral
BALL DONT LIE,1 stars,0.2834693193435669,sarcasm_less,0.9989055395126343,neutral
Nix moonballs are beautiful.,5 stars,0.4293353259563446,sarcasm_less,0.9999897480010986,neutral
"Moonballs are a Russ thing, though.",3 stars,0.5100781321525574,sarcasm_less,0.999984860420227,neutral
Moonball is any ball that is chucked and threaded to a deep receiver. Russ is just the most prevalent example because he has great arm strength and likes to just chuck it to someone near the sidelines.,4 stars,0.3422006368637085,sarcasm_less,0.9999903440475464,neutral
No the streak :(,1 stars,0.3939155042171478,sarcasm_less,0.9962073564529419,neutral
Was that Bo Nix's first incomplete pass?,1 stars,0.49287909269332886,sarcasm_less,0.9998519420623779,neutral
Payton not taking the timeout before Butker's kick probably cost them points here,3 stars,0.31170058250427246,sarcasm_less,0.9996544122695923,neutral
Is it really necessary to go to commercial 3 seconds before the half?,1 stars,0.37975987792015076,sarcasm_less,0.9998886585235596,neutral
What else are we watching for?,3 stars,0.2513600289821625,sarcasm_less,0.9992489218711853,neutral
"Yes, because not enough timeouts were used in the first half.",3 stars,0.4101376533508301,sarcasm_less,0.9999891519546509,neutral
Coaches are in desperate need of learning when to use their timeouts in the final 30 seconds of the halves,2 stars,0.3740949332714081,sarcasm_less,0.9997145533561707,neutral
Just hire some game theory specialist to do it for you,4 stars,0.32424676418304443,sarcasm_less,0.994071900844574,neutral
We have to watch Russell Wilson in playoffs instead of burrow sadly,2 stars,0.26715847849845886,sarcasm_less,0.9600867033004761,neutral
Shut it! lol,1 stars,0.7730192542076111,sarcasm_less,0.9831279516220093,neutral
Tough watch tbh. Stroud as well lately,5 stars,0.5338120460510254,sarcasm_less,0.9999845027923584,neutral
I know lol. Russ sucks but he's my guy for right now so I'm all in !,4 stars,0.30627068877220154,sarcasm_less,0.9999749660491943,neutral
That's the real travesty. Broncos and Bengals both deserve to be in over them lmao,1 stars,0.25579532980918884,sarcasm_less,0.6617666482925415,neutral
24-0 at half? Oh boy I've seen this one before!,1 stars,0.4645960032939911,sarcasm_more,0.9986194372177124,sarcastic
Broncos can kneel out the rest of their snaps and still win the game,5 stars,0.41269758343696594,sarcasm_less,0.999935507774353,neutral
the cope in this thread is reach catastrophic levels,1 stars,0.6568438410758972,sarcasm_less,0.9970834851264954,neutral
Hot take: I don't think Romo's been that bad in the booth today,3 stars,0.3143180310726166,sarcasm_less,0.9998192191123962,neutral
He did mention the steelers could beat any team in the playoffs. That's where he lost me,1 stars,0.286065936088562,sarcasm_less,0.9999874830245972,neutral
Crazy how much better he is when Allen or Mahomes aren't on the field,5 stars,0.38628941774368286,sarcasm_less,0.8083868622779846,neutral
Imagine having an incomplete pass,1 stars,0.41184893250465393,sarcasm_less,0.9931302666664124,neutral
I see Wentz still doesn't handle pressure well.,3 stars,0.5328061580657959,sarcasm_less,0.9999879598617554,neutral
In Rugby it isn't a forward pass if the momentum carries it forward. I feel like they're much better experts on the subject.,3 stars,0.47551867365837097,sarcasm_less,0.9999871253967285,neutral
Kids these days don't know the literal Houdini tricks Wentz pulled weekly in 2017,1 stars,0.5020707249641418,sarcasm_more,0.656430721282959,neutral
It was a different time. If only we could go back,2 stars,0.2979663908481598,sarcasm_less,0.9999847412109375,neutral
I was in the crowd chanting MVP for him. What a strange outcome of his career.,1 stars,0.3750600516796112,sarcasm_less,0.9999897480010986,neutral
"Really strange. That Clowney hit combined with the reported locker room issues ruined his career. Part of it is because of how he played and who he is, part of it is just pure lack of luck.",2 stars,0.4817350208759308,sarcasm_less,0.999962329864502,neutral
The problem is that he still thinks he can pull them off,3 stars,0.4503394067287445,sarcasm_less,0.9995724558830261,neutral
I forgot Felix exists,1 stars,0.39352643489837646,sarcasm_less,0.9991389513015747,neutral
So did we,3 stars,0.42554497718811035,sarcasm_less,0.9925280809402466,neutral
Yeah this is the weirdest game thread of the season for us and that's really saying something lol,5 stars,0.5792825222015381,sarcasm_less,0.5918030142784119,neutral
Why do I lowkey want to watch the Nickelodeon football games next weekend lol,1 stars,0.3855820298194885,sarcasm_less,0.812161922454834,neutral
I've seen some clips â€“ some of them have some funny moments,3 stars,0.6045580506324768,sarcasm_less,0.9999423027038574,neutral
"If you don't really care about the teams, it's kind of fun to switch back and forth to.",3 stars,0.6509266495704651,sarcasm_less,0.9999858140945435,neutral
Can't say for sure but Carson Wentz might be washed you guys.,3 stars,0.4735531806945801,sarcasm_less,0.9999889135360718,neutral
I'm happy Romo and Nantz are forced to commentate this bullshit game.,1 stars,0.5510608553886414,sarcasm_less,0.9999701976776123,neutral
Absolute fucking piss missile,1 stars,0.954559326171875,sarcasm_more,0.8401325345039368,neutral
I love Vele. Such a steal.,5 stars,0.8487425446510315,sarcasm_less,0.9999836683273315,positive
This years QB Class has been wild,5 stars,0.6630834937095642,sarcasm_less,0.9984727501869202,neutral
I think JJ will be good too,3 stars,0.37304335832595825,sarcasm_less,0.9972676038742065,neutral
It really has.,5 stars,0.6261138319969177,sarcasm_less,0.9999798536300659,neutral
Penix and Daniels look amazing. Nix has been hot at times but can get shaky.,4 stars,0.4773856997489929,sarcasm_less,0.9999909400939941,neutral
Mahomes cant even score 1 touchdown. Lmao. Bro is washed,1 stars,0.7774280309677124,sarcasm_less,0.989368736743927,neutral
"Can't tell if sarcasm, or an bot.",2 stars,0.2696363627910614,sarcasm_less,0.9999874830245972,neutral
I for one am shocked that a team with the playoffs on the line would be able to beat the second stringers of a team with nothing in the line.,3 stars,0.32919588685035706,sarcasm_less,0.9999843835830688,neutral
i love you bo nix,5 stars,0.6399268507957458,sarcasm_less,0.9952564835548401,neutral
Please don't rest mimms. Need 8 more yards for 500 bucks..,1 stars,0.6950704455375671,sarcasm_less,0.9999886751174927,neutral
The biggest thing about this game to me is still Butker missing that kick.,1 stars,0.4395458996295929,sarcasm_less,0.9999889135360718,neutral
Honestly if we lose in the playoffs I hope it is as a direct result of a Butker kick.,3 stars,0.2722671329975128,sarcasm_less,0.9999898672103882,neutral
BOLIEVERS ARE EATING GOOD.,4 stars,0.5054739713668823,sarcasm_less,0.9999897480010986,neutral
I need to hit the range soon. The Masters' theme is making me anxious for some reason.,3 stars,0.6568867564201355,sarcasm_less,0.9999878406524658,neutral
Denver beating buffalo next week would be amazing,4 stars,0.3156222999095917,sarcasm_less,0.9994913339614868,neutral
"I, too, would like to see this.",4 stars,0.3931501507759094,sarcasm_less,0.9999897480010986,neutral
Remegio is still better than Sky Moore and Kadarius Toney,4 stars,0.4382808208465576,sarcasm_less,0.999600350856781,neutral
Wait what the fuck?,1 stars,0.6588783264160156,sarcasm_more,0.9565050005912781,sarcastic
We need to just sit our starters now. They've done enough,5 stars,0.35440436005592346,sarcasm_less,0.9999891519546509,neutral
